dialog_id,CooperativityRate,Turn Exchange,Formal System Query,NL System Query,Formal User Response,User Response,NL_Student,Correctness Rate,Naturalness Rate,Evaluator,Comments,Board
699,60,0,Start(),Hey! Can you show me how to play Quarto?,Start,"Yes, let's get started!",Ruijie,5,5,Luke,,0-0-0-0-0-0-0-0-0-0-0-0-0-0-0-0
699,60,1,RequestNewWinCondition(),"Can you show me what a win condition looks like?
",Inform,Assume you demonstrate this win condition,Ruijie,5,5,Luke,,1-0-0-0-0-11-0-0-0-0-12-0-0-0-0-2
699,60,2,"Same, Confirm(User_ID=1, Quantity)","Does the number of pieces make it a win?
",Affirm(),"Yes, that's correct!
",Ruijie,4,5,Luke,,1-0-0-0-0-11-0-0-0-0-12-0-0-0-0-2
699,60,3,RequestNewWinCondition(),"Can you show me a new win?
",Inform,Assume you demonstrate this win condition,Ruijie,5,5,Luke,,0-0-0-0-0-0-0-0-0-0-0-0-2-9-1-14
699,60,4,"Same, RequestOtherPlayers()","Can the other player undo this win?
",Inform([]),"No, this win is absolute.
",Ruijie,5,5,Luke,,0-0-0-0-0-0-0-0-0-0-0-0-2-9-1-14
699,60,5,"Context Switch, Confirm(User_ID=1, Color)","Switch to this board, is it a win because the pieces are in the same color?
",NotSure(),"Well, I'm not sure.",Ruijie,5,5,Luke,,1-0-0-0-0-11-0-0-0-0-12-0-0-0-0-2
699,60,6,RequestNewWinCondition(),"Can you show me a new win?
",Inform,Assume you demonstrate this win condition,Ruijie,5,5,Luke,,13-0-0-0-0-14-0-0-0-0-12-0-0-0-0-11
699,60,7,"Context Switch, Confirm(User_ID=1, Color)","Switch to this board, is it a win because of the color of the pieces?",NotSure(),"You know what, I’m not quite sure.",Ruijie,5,5,Luke,,1-0-0-0-0-11-0-0-0-0-12-0-0-0-0-2
699,60,8,"Context Switch, Confirm(User_ID=1, Hollowness)","Switch to this board, does the hollowness of the pieces make it a win?
",Negate(),"No, it’s unrelated.
",Ruijie,5,5,Luke,,13-0-0-0-0-14-0-0-0-0-12-0-0-0-0-11
699,60,9,RequestNewWinCondition(),Can you show me a new win?,Inform,Assume you demonstrate this win condition,Ruijie,5,5,Luke,,2-0-0-0-3-0-0-0-5-0-0-0-4-0-0-0
699,60,10,"Same, Confirm(User_ID=1, Hollowness)","Does the hollowness of the pieces make it a win?
",Negate(),"No, that’s not the reason.",Ruijie,5,5,Luke,,2-0-0-0-3-0-0-0-5-0-0-0-4-0-0-0
699,60,11,"Context Switch, Request(User_ID=1, Rotate)","Switch to this board, can I rotate the pieces by some degrees?
",Inform([90]),"Yup, you can rotate them by ninety degrees.
",Ruijie,4,5,Luke,,1-0-0-0-0-11-0-0-0-0-12-0-0-0-0-2
699,60,12,"Context Switch, Confirm(User_ID=1, Color)","Switch to this board, is it a win because the pieces are of the color?",Negate(),"No, I don't think so.",Ruijie,5,5,Luke,,2-0-0-0-3-0-0-0-5-0-0-0-4-0-0-0
699,60,13,"Same, Request(User_ID=1, Rotate)",Can I rotate the pieces by some degrees and still have a win?,"Inform([0, 45])","Yes, you can rotate them by forty five degrees.",Ruijie,3,5,Luke,,2-0-0-0-3-0-0-0-5-0-0-0-4-0-0-0
699,60,14,"Context Switch, Confirm(User_ID=1, Color)","Switch to this board, is it a win because the pieces are in the same color?
",Negate(),"No, that’s not the reason.
",Ruijie,5,5,Luke,,1-0-0-0-0-11-0-0-0-0-12-0-0-0-0-2
699,60,15,Finish(),Thanks! I learned so much from you!,Finish,You are welcome!,Ruijie,5,5,Luke,,1-0-0-0-0-11-0-0-0-0-12-0-0-0-0-2
