dialog_id,CooperativityRate,Turn Exchange,Formal System Query,NL System Query,Formal User Response,User Response,NL_Student,Correctness Rate,Naturalness Rate,Evaluator,Comments,Board
195,100,0,Start(),"Hello, can you show me how to play Quarto?",Start,"Sure, let's get started.",Yiyan,5,4,Derek,,0-0-0-0-0-0-0-0-0-0-0-0-0-0-0-0
195,100,1,RequestNewWinCondition(),Could you firstly show me a winning condition?,Inform(),Assume you demonstrate this win condition,Yiyan,5,4,Derek,,3-0-0-0-9-0-0-0-12-0-0-0-11-0-0-0
195,100,2,RequestNewWinCondition(),Can you show me another way to win?,Inform(),Assume you demonstrate this win condition,Yiyan,5,5,Derek,,0-0-0-4-0-0-2-0-0-7-0-0-1-0-0-0
195,100,3,"Context Switch, Confirm(User_ID=1, Translate('col1'))","For this winning condition, can I move all the pieces one column right?",Affirm,"Yes, you can do that, and it will still be a winning.",Yiyan,3,4,Derek,,3-0-0-0-9-0-0-0-12-0-0-0-11-0-0-0
195,100,4,RequestNewWinCondition(),Is there any other ways to win?,Inform(),Assume you demonstrate this win condition,Yiyan,5,4,Derek,,11-0-0-0-0-10-0-0-0-0-4-0-0-0-0-12
195,100,5,"Same, RequestOtherPlayers()","In this situation, how can the other player do to prevent my winning?",Inform([]),"No, there is no way to prevent the winning condition.",Yiyan,5,4,Derek,,11-0-0-0-0-10-0-0-0-0-4-0-0-0-0-12
195,100,6,"Context Switch, Confirm(User_ID=1, Shape)","For this winning condition, is the shape of pieces the reason that I win?",Affirm(),"Yes, you win because you get all  triangle pieces.",Yiyan,3,4,Derek,,3-0-0-0-9-0-0-0-12-0-0-0-11-0-0-0
195,100,7,"Context Switch, Confirm(User_ID=1, Rotate(90))","For this winning condition, can I rearrange the pieces into a column?",Affirm(),"Yes, you can do that.",Yiyan,3,3,Derek,,0-0-0-4-0-0-2-0-0-7-0-0-1-0-0-0
195,100,8,"Context Switch, Confirm(User_ID=1, Color)",Is this a winning condition because of the color of the pieces?,Negate(),"No, the color of pieces does not matter.",Yiyan,3,4,Derek,,11-0-0-0-0-10-0-0-0-0-4-0-0-0-0-12
195,100,9,"Context Switch, Confirm(User_ID=1, Color)","Let's switch to this winning board, is it a winning board because of the color of pieces?",Negate(),"No, the color still does not matter.",Yiyan,3,5,Derek,,3-0-0-0-9-0-0-0-12-0-0-0-11-0-0-0
195,100,10,"Context Switch, Confirm(User_ID=1, AddPiece(3,3))","In this winning condition, is it still a winning if I add a piece in the top left corner?",Affirm(),"Yes, actually you can add pieces anywhere.",Yiyan,1,4,Derek,I think it should be top right corner,11-0-0-0-0-10-0-0-0-0-4-0-0-0-0-12
195,100,11,"Same , Confirm(User_ID=1, Shape)","For the same game board, does the shape of the pieces relate to the winning?",Affirm(),"Yes, you win because you all triangle pieces.",Yiyan,4,4,Derek,,11-0-0-0-0-10-0-0-0-0-4-0-0-0-0-12
195,100,12,"Context Switch, Confirm(User_ID=1, AddPiece(1,0))","In this new board, what if I add a piece on the second column of the first row?",Affirm(),Then it will still be a winning.,Yiyan,3,3,Derek,,0-0-0-4-0-0-2-0-0-7-0-0-1-0-0-0
195,100,13,"Win Same {'ActionName': 'Confirm_Hollowness', 'FirstPart': None, 'ID': 1, 'SecondPart': None}",I wonder if it is the hollowness that lead to a winning for this winning board.,Negate(),"No, in this case the hollowness does not matter.",Yiyan,5,4,Derek,,0-0-0-4-0-0-2-0-0-7-0-0-1-0-0-0
195,100,14,"Win Context Switch {'ActionName': 'Confirm_Hollowness', 'FirstPart': None, 'ID': 1, 'SecondPart': None}","For this winning board, it is a win because I get three pieces with hollow?",Negate(),"No, the hollow does not lead to the winning in this case.",Yiyan,5,3,Derek,,3-0-0-0-9-0-0-0-12-0-0-0-11-0-0-0
195,100,15,Finish(),Thank you for your help.,Finish,You are welcome.,Yiyan,5,4,Derek,,3-0-0-0-9-0-0-0-12-0-0-0-11-0-0-0
