dialog_id,CooperativityRate,Turn Exchange,Formal System Query,NL System Query,Formal User Response,User Response,NL_Student,Correctness Rate,Naturalness Rate,Evaluator,Comments,Board
1204,60,0,Start(),"Hi, could you teach me how to play Quarto?",Start,"Sure, let's get started!",Shaobo,5,5,John,,0-0-0-0-0-0-0-0-0-0-0-0-0-0-0-0
1204,60,1,RequestNewWinCondition(),Could you show me a win first?,Inform,Assume you demonstrate this win condition,Shaobo,5,5,John,,0-0-0-0-0-0-0-0-0-0-0-0-12-11-4-2
1204,60,2,"Same, Request(User_ID=1, Translate)",And how could I shift the pieces and still keep the win?,"Inform(['row2', 'row3'])",You could shift them to the third or the top row,Shaobo,5,5,John,,0-0-0-0-0-0-0-0-0-0-0-0-12-11-4-2
1204,60,3,"Same, Confirm(User_ID=1, Hollowness)",And is it a win because of the hollowness of the pieces?,NotSure(),"Sorry, I am not sure about it.",Shaobo,5,4,John,,0-0-0-0-0-0-0-0-0-0-0-0-12-11-4-2
1204,60,4,RequestNewWinCondition(),Is there any other way to win?,Inform,Assume you demonstrate this win condition,Shaobo,5,5,John,,0-0-11-0-0-0-14-0-0-0-13-0-0-0-15-0
1204,60,5,"Context Switch, Confirm(User_ID=1, Color)","Switching to this board, is it a win because of the color of the pieces?",NotSure(),"Sorry, I am not sure about it.",Shaobo,5,4,John,,0-0-0-0-0-0-0-0-0-0-0-0-12-11-4-2
1204,60,6,RequestNewWinCondition(),Could you show me another winning board?,Inform,Assume you demonstrate this win condition,Shaobo,5,5,John,,0-0-0-0-0-0-0-0-0-0-0-0-3-1-8-6
1204,60,7,RequestNewWinCondition(),Could you show me one more winning board?,Inform,Assume you demonstrate this win condition,Shaobo,5,5,John,,12-0-0-0-0-11-0-0-0-0-8-0-0-0-0-3
1204,60,8,RequestNewWinCondition(),I need one more winning board for a better understanding.,Inform,Assume you demonstrate this win condition,Shaobo,5,5,John,,10-0-0-0-6-0-0-0-5-0-0-0-9-0-0-0
1204,60,9,"Context Switch, Confirm(User_ID=1, AddPiece(2,0))","Switching to this board, is it still a win if I add a piece on the third row and the leftmost column?",Affirm(),"Yes, it is still a win.",Shaobo,5,5,John,,12-0-0-0-0-11-0-0-0-0-8-0-0-0-0-3
1204,60,10,Finish(),Thanks for the help! I have learned a lot!,Finish,You are welcome!,Shaobo,5,5,John,,12-0-0-0-0-11-0-0-0-0-8-0-0-0-0-3
