dialog_id,CooperativityRate,Turn Exchange,Formal System Query,NL System Query,Formal User Response,User Response,NL_Student,Correctness Rate,Naturalness Rate,Evaluator,Comments,Board
424,50,0,Start(),"Hi there, can you show me how to play Quarto?",Start,"Sure, let's get started.",Jason,,,,,0-0-0-0-0-0-0-0-0-0-0-0-0-0-0-0
424,50,1,RequestNewWinCondition(),Can you show me an example of a win in Quarto?,Inform,Assume you demonstrate this win condition,Jason,,,,,0-10-0-0-0-9-0-0-0-13-0-0-0-6-0-0
424,50,2,"Same, Confirm(User_ID=1, Color)","With the win you just showed me, can you tell me if the color of the pieces have to do with why it's a valid win?",Negate(),The color of the pieces are totally irrelevant to why this is a winning board.,Jason,,,,,0-10-0-0-0-9-0-0-0-13-0-0-0-6-0-0
424,50,3,"Same, Confirm(User_ID=1, RemovePiece(2,1))","With the same board, could you remove the green triangle and still have a win?",NotSure(),"Hmm, I'm not sure.",Jason,,,,,0-10-0-0-0-9-0-0-0-13-0-0-0-6-0-0
424,50,4,"Same, Confirm(User_ID=1, Color)","Sticking with this board, is the color of the pieces the reason why this is a winning board?",NotSure(),I'm not sure about that as well.,Jason,,,,,0-10-0-0-0-9-0-0-0-13-0-0-0-6-0-0
424,50,5,RequestNewWinCondition(),Can you show me another way to win Quarto?,Inform,Assume you demonstrate this win condition,Jason,,,,,0-0-0-8-0-0-4-0-0-11-0-0-16-0-0-0
424,50,6,"Context Switch, Confirm(User_ID=1, Height)","Switching back to that other board, can you tell me if the height of the pieces are why it's considered a win?",NotSure(),"Sorry, I also don't know the answer to that question.",Jason,,,,,0-10-0-0-0-9-0-0-0-13-0-0-0-6-0-0
424,50,7,"Same, Confirm(User_ID=1, Quantity)","Okay, with the same board can you tell me if the quantity of the pieces are why it's considered a win?",Affirm(),"Yeah, the number of pieces have to be at least 4 in a row.",Jason,,,,,0-10-0-0-0-9-0-0-0-13-0-0-0-6-0-0
424,50,8,"Same, Confirm(User_ID=1, Height)","With the same board, is the height of the pieces a factor to this being a winning board?",NotSure(),"I'm not sure, to be honest.",Jason,,,,,0-10-0-0-0-9-0-0-0-13-0-0-0-6-0-0
424,50,9,RequestNewWinCondition(),Can you show me another example of a winning board?,Inform,Assume you demonstrate this win condition,Jason,,,,,10-0-0-0-0-11-0-0-0-0-16-0-0-0-0-14
424,50,10,"Context Switch, Confirm(User_ID=1, Height)","Switching back to this other board, can you tell me if the height of the pieces are why this is considered a win?",Negate(),The height of the pieces have nothing to do with this being a win.,Jason,,,,,0-10-0-0-0-9-0-0-0-13-0-0-0-6-0-0
424,50,11,"Context Switch, Confirm(User_ID=1, Height)","What about this board, is the height of the pieces a reason why this is a win for this case?",NotSure(),"Honestly, I don't know.",Jason,,,,,0-0-0-8-0-0-4-0-0-11-0-0-16-0-0-0
424,50,12,"Same, Confirm(User_ID=1, RemovePiece(2,2))","With that same board I just showed you, would it still be a win if you removed the blue striped triangle?",NotSure(),"Sorry, I don't know the answer to that question either.",Jason,,,,,0-0-0-8-0-0-4-0-0-11-0-0-16-0-0-0
424,50,13,"Context Switch, Confirm(User_ID=1, Hollowness)","Switching back to this board, is the hollowness of the pieces a reason why it's a win?",Affirm(),"Yes, it's because all the pieces have the same hollowness.",Jason,,,,,0-10-0-0-0-9-0-0-0-13-0-0-0-6-0-0
424,50,14,"Same, Confirm(User_ID=1, RemovePiece(0,1))","With that same board, could you remove the bottom circle and still have a win?",Negate(),"No, you wouldn't have a win anymore.",Jason,,,,,0-10-0-0-0-9-0-0-0-13-0-0-0-6-0-0
424,50,15,Finish(),"Alright, I think I know enough to play now. Thanks for the help!",Finish,"No problem, hope we can play soon!",Jason,,,,,0-10-0-0-0-9-0-0-0-13-0-0-0-6-0-0
