dialog_id,CooperativityRate,Turn Exchange,Formal System Query,NL System Query,Formal User Response,User Response,NL_Student,Correctness Rate,Naturalness Rate,Evaluator,Comments,Board
1030,60,0,Start(),"Hi, can you give me some advice on playing Quarto?",Start,Sure.,Tianyi,5,5,Ruijie,,0-0-0-0-0-0-0-0-0-0-0-0-0-0-0-0
1030,60,1,RequestNewWinCondition(),Can you give me an example of win?,Inform,Assume you demonstrate this win condition,Tianyi,5,5,Ruijie,,0-0-0-0-0-0-0-0-0-0-0-0-6-5-16-7
1030,60,2,RequestNewWinCondition(),Can you give me another example of win?,Inform,Assume you demonstrate this win condition,Tianyi,5,5,Ruijie,,10-0-0-0-0-5-0-0-0-0-1-0-0-0-0-14
1030,60,3,"Context Switch, Confirm(User_ID=1, Hollowness)","Back to this board, is it wins because some pieces are hollow?",NotSure(),I have no idea about this.,Tianyi,5,4,Ruijie,,0-0-0-0-0-0-0-0-0-0-0-0-6-5-16-7
1030,60,4,"Same, Confirm(User_ID=1, Quantity)","And, is it a win because there are four pieces on the board?",Affirm(),Yeah.,Tianyi,5,5,Ruijie,,0-0-0-0-0-0-0-0-0-0-0-0-6-5-16-7
1030,60,5,"Context Switch, Confirm(User_ID=1, Quantity)","In this win, is it a win because of the quantity of the pieces?",Affirm(),"Yes, it is.",Tianyi,5,4,Ruijie,,10-0-0-0-0-5-0-0-0-0-1-0-0-0-0-14
1030,60,6,"Context Switch, Confirm(User_ID=1, AddPiece(1,1))","In this winning board, if I put a new piece at the second column of the second row, can it still be a win?",Affirm(),"Yes, it will still be a win.",Tianyi,4,4,Ruijie,,0-0-0-0-0-0-0-0-0-0-0-0-6-5-16-7
1030,60,7,"Same, Confirm(User_ID=1, Quantity)","And, is it a win because there are four pieces on the board?",NotSure(),I am uncertain about this.,Tianyi,4,4,Ruijie,,0-0-0-0-0-0-0-0-0-0-0-0-6-5-16-7
1030,60,8,"Context Switch, RequestOtherPlayers()","In this case, can someone take actions to prevent the win?",Inform([]),"No, he/she can't.",Tianyi,5,4,Ruijie,,10-0-0-0-0-5-0-0-0-0-1-0-0-0-0-14
1030,60,9,RequestNewWinCondition(),Can you show me a new winning board?,Inform,Assume you demonstrate this win condition,Tianyi,5,4,Ruijie,,9-0-0-0-0-11-0-0-0-0-14-0-0-0-0-15
1030,60,10,"Context Switch, Confirm(User_ID=1, Shape)","In this board, is it wins because all pieces have the same shape?",Affirm(),"Yes, that's it.",Tianyi,5,5,Ruijie,,0-0-0-0-0-0-0-0-0-0-0-0-6-5-16-7
1030,60,11,RequestNewWinCondition(),Can you show me another new winning board?,Inform,Assume you demonstrate this win condition,Tianyi,4,5,Ruijie,,12-0-0-0-2-0-0-0-16-0-0-0-6-0-0-0
1030,60,12,RequestNewWinCondition(),What else can be a winning board?,Inform,Assume you demonstrate this win condition,Tianyi,5,4,Ruijie,,0-8-0-0-0-5-0-0-0-13-0-0-0-7-0-0
1030,60,13,"Context Switch, Request(User_ID=1, Rotate)","In this case, can I rotate some pieces and still maintain the win?","Inform([0, 45])","Yes, you can rotate all pieces 0 degrees to the rows and put them in the first row, or you can rotate all pieces 45 degrees to the rows and put them in the diagonal.",Tianyi,5,4,Ruijie,,12-0-0-0-2-0-0-0-16-0-0-0-6-0-0-0
1030,60,14,Finish(),"Thanks, that really helps.",Finish,You are welcome.,Tianyi,4,4,Ruijie,,12-0-0-0-2-0-0-0-16-0-0-0-6-0-0-0
