dialog_id,CooperativityRate,Turn Exchange,Formal System Query,NL System Query,Formal User Response,User Response,NL_Student,Correctness Rate,Naturalness Rate,Evaluator,Comments,Board
1000,60,0,Start(),"Hello, can you teach me how to play Quarto?",Start,Ok.,Tianyi,5,5,Ruijie,,0-0-0-0-0-0-0-0-0-0-0-0-0-0-0-0
1000,60,1,RequestNewWinCondition(),Can you give me a win?,Inform,Assume you demonstrate this win condition,Tianyi,5,4,Ruijie,,0-0-0-9-0-0-15-0-0-12-0-0-16-0-0-0
1000,60,2,"Same, Request(User_ID=1, Rotate)","In this case, can I rotate some pieces and still maintain the win?",Inform([90]),"Yes, you can rotate all pieces 90 degrees to the rows and put them in the first column.",Tianyi,5,4,Ruijie,,0-0-0-9-0-0-15-0-0-12-0-0-16-0-0-0
1000,60,3,RequestNewWinCondition(),Can you give me another win?,Inform,Assume you demonstrate this win condition,Tianyi,5,5,Ruijie,,0-0-0-0-0-0-0-0-0-0-0-0-8-7-1-4
1000,60,4,RequestNewWinCondition(),Can you show me a win pattern?,Inform,Assume you demonstrate this win condition,Tianyi,5,5,Ruijie,,0-0-7-0-0-0-3-0-0-0-4-0-0-0-16-0
1000,60,5,"Context Switch, Confirm(User_ID=1, Quantity)","In this win, is it a win because of the quantity of the pieces?",Affirm(),Yes.,Tianyi,5,4,Ruijie,,0-0-0-9-0-0-15-0-0-12-0-0-16-0-0-0
1000,60,6,"Context Switch, Confirm(User_ID=1, RemovePiece(2,2))","In this win, if I remove the piece at the third row, is it still a win?",Negate(),"No, it will no longer be a win if you do that.",Tianyi,5,4,Ruijie,,0-0-7-0-0-0-3-0-0-0-4-0-0-0-16-0
1000,60,7,RequestNewWinCondition(),Can you show me another new win pattern?,Inform,Assume you demonstrate this win condition,Tianyi,5,5,Ruijie,,0-0-0-7-0-0-16-0-0-13-0-0-14-0-0-0
1000,60,8,"Context Switch, Confirm(User_ID=1, Color)","For this board, is it wins because some pieces are green?",Negate(),Nope.,Tianyi,5,4,Ruijie,,0-0-0-9-0-0-15-0-0-12-0-0-16-0-0-0
1000,60,9,"Same, Confirm(User_ID=1, Quantity)","And, is it a win because there are four pieces on the board?",Affirm(),Yeah.,Tianyi,5,4,Ruijie,,0-0-0-9-0-0-15-0-0-12-0-0-16-0-0-0
1000,60,10,Finish(),"Thanks, very great learning experience.",Finish,You are welcome.,Tianyi,5,5,Ruijie,,0-0-0-9-0-0-15-0-0-12-0-0-16-0-0-0
