dialog_id,CooperativityRate,Turn Exchange,Formal System Query,NL System Query,Formal User Response,User Response,NL_Student,Correctness Rate,Naturalness Rate,Evaluator,Comments,Board
914,60,0,Start(),"Hi, will you teach me Quarto?",Start,Sure thing. ,Anthony,5,5,Yiyen,,0-0-0-0-0-0-0-0-0-0-0-0-0-0-0-0
914,60,1,RequestNewWinCondition(),Please show me a new win condition.,Inform,Assume you demonstrate this win condition,Anthony,5,5,Yiyen,,0-0-0-15-0-0-11-0-0-16-0-0-14-0-0-0
914,60,2,RequestNewWinCondition(),Please show me another win condition. ,Inform,Assume you demonstrate this win condition,Anthony,5,5,Yiyen,,0-0-0-12-0-0-10-0-0-9-0-0-4-0-0-0
914,60,3,"Same, Confirm(User_ID=1, Hollowness)",Is this a win because of the hollowness of the pieces?,Negate(),"No, that is not why. ",Anthony,5,5,Yiyen,,0-0-0-12-0-0-10-0-0-9-0-0-4-0-0-0
914,60,4,"Same, Confirm(User_ID=1, RemovePiece(2,2))",Could I remove the piece at this location?,NotSure(),"I apologize, I'm not sure.",Anthony,3,5,Yiyen,,0-0-0-12-0-0-10-0-0-9-0-0-4-0-0-0
914,60,5,"Same, RequestOtherPlayers()",What moves could another player take to undo this win?,Inform([]),There are no moves that could undo this win. ,Anthony,5,5,Yiyen,,0-0-0-12-0-0-10-0-0-9-0-0-4-0-0-0
914,60,6,"Same, Confirm(User_ID=1, Shape)",Is this a win condition because of the shape of the pieces?,NotSure(),I'm not sure. ,Anthony,5,5,Yiyen,,0-0-0-12-0-0-10-0-0-9-0-0-4-0-0-0
914,60,7,RequestNewWinCondition(),Please show me a new win condition.,Inform,Assume you demonstrate this win condition,Anthony,5,5,Yiyen,,1-0-0-0-4-0-0-0-3-0-0-0-11-0-0-0
914,60,8,RequestNewWinCondition(),Please show me one more.,Inform,Assume you demonstrate this win condition,Anthony,5,5,Yiyen,,14-0-0-0-11-0-0-0-13-0-0-0-9-0-0-0
914,60,9,"Same, Confirm(User_ID=1, Color)",Is this one a win because of the color of the pieces?,Negate(),"No, the color is not all the same. ",Anthony,5,5,Yiyen,,14-0-0-0-11-0-0-0-13-0-0-0-9-0-0-0
914,60,10,"Context Switch, RequestOtherPlayers()","Looking at this board, how could another player undo this win?",Inform([]),There is nothing another player could do. ,Anthony,5,5,Yiyen,,1-0-0-0-4-0-0-0-3-0-0-0-11-0-0-0
914,60,11,Finish(),"Okay, that's all for now. Thanks.",Finish,Goodbye. ,Anthony,5,5,Yiyen,,1-0-0-0-4-0-0-0-3-0-0-0-11-0-0-0
