dialog_id,CooperativityRate,Turn Exchange,Formal System Query,NL System Query,Formal User Response,User Response,NL_Student,Correctness Rate,Naturalness Rate,Evaluator,Comments,Board
979,60,0,Start(),"Hello, can you teach me some Quarto Strategies?",Start,Ok.,Tianyi,5,5,Ruijie,,0-0-0-0-0-0-0-0-0-0-0-0-0-0-0-0
979,60,1,RequestNewWinCondition(),Can you show me a win pattern?,Inform,Assume you demonstrate this win condition,Tianyi,5,5,Ruijie,,0-5-0-0-0-9-0-0-0-3-0-0-0-11-0-0
979,60,2,"Same, Request(User_ID=1, Translate)","For this board, can I move some pieces and still keep the win?",Inform(['col2']),"Yes, you can move all pieces to the third column.",Tianyi,5,4,Ruijie,,0-5-0-0-0-9-0-0-0-3-0-0-0-11-0-0
979,60,3,RequestNewWinCondition(),Can you show me another win pattern?,Inform,Assume you demonstrate this win condition,Tianyi,5,5,Ruijie,,0-0-0-0-0-0-0-0-0-0-0-0-6-5-2-7
979,60,4,"Context Switch, Confirm(User_ID=1, Hollowness)","Back to this board, is it wins because some pieces are hollow?",Negate(),"No, that is not the reason.",Tianyi,5,5,Ruijie,,0-5-0-0-0-9-0-0-0-3-0-0-0-11-0-0
979,60,5,"Same, Confirm(User_ID=1, RemovePiece(1,1))","If I remove the piece at the second row, is it still a win?",Negate(),"No, it will no longer be a win if you do that.",Tianyi,5,4,Ruijie,,0-5-0-0-0-9-0-0-0-3-0-0-0-11-0-0
979,60,6,"Context Switch, Confirm(User_ID=1, Height)","In this case, is it a win because some pieces are short?",Affirm(),"Yes, you are right.",Tianyi,5,4,Ruijie,,0-0-0-0-0-0-0-0-0-0-0-0-6-5-2-7
979,60,7,"Same, Confirm(User_ID=1, Translate([2, 0]))","If I move all pieces two blocks up, can it still be a win?",Affirm(),"Yes, it will still be a win.",Tianyi,5,5,Ruijie,,0-0-0-0-0-0-0-0-0-0-0-0-6-5-2-7
979,60,8,"Same, Confirm(User_ID=1, Shape)",Is it wins because of the shape of the pieces?,Negate(),"No, that is not the reason.",Tianyi,5,5,Ruijie,,0-0-0-0-0-0-0-0-0-0-0-0-6-5-2-7
979,60,9,"Context Switch, Confirm(User_ID=1, Height)","In this case, is it a win because some pieces are tall?",Negate(),Nope.,Tianyi,4,4,Ruijie,,0-5-0-0-0-9-0-0-0-3-0-0-0-11-0-0
979,60,10,Finish(),Thank you for your sharing.,Finish,You are welcome.,Tianyi,5,5,Ruijie,,0-5-0-0-0-9-0-0-0-3-0-0-0-11-0-0
