dialog_id,CooperativityRate,Turn Exchange,Formal System Query,NL System Query,Formal User Response,User Response,NL_Student,Correctness Rate,Naturalness Rate,Evaluator,Comments,Board
1034,60,0,Start(),"Hi, can you tell me how to play Quarto?",Start,"Sure, let's begin.",Tianyi,5,5,Ruijie,,0-0-0-0-0-0-0-0-0-0-0-0-0-0-0-0
1034,60,1,RequestNewWinCondition(),Can you show me a winning board?,Inform,Assume you demonstrate this win condition,Tianyi,5,5,Ruijie,,0-0-0-0-0-0-0-0-0-0-0-0-8-12-4-3
1034,60,2,RequestNewWinCondition(),Can you show me another winning board?,Inform,Assume you demonstrate this win condition,Tianyi,5,5,Ruijie,,11-0-0-0-0-16-0-0-0-0-4-0-0-0-0-3
1034,60,3,RequestNewWinCondition(),What else can be a winning board?,Inform,Assume you demonstrate this win condition,Tianyi,5,5,Ruijie,,0-0-0-0-0-0-0-0-0-0-0-0-7-15-5-14
1034,60,4,RequestNewWinCondition(),Can you give me a new win?,Inform,Assume you demonstrate this win condition,Tianyi,5,5,Ruijie,,9-0-0-0-0-11-0-0-0-0-16-0-0-0-0-13
1034,60,5,"Context Switch, Confirm(User_ID=1, Rotate(90))","In this case, if I rotate all pieces 90 degrees to the rows and put them in the first column, is it still a win?",NotSure(),I have no idea about this. Maybe you are right.,Tianyi,5,4,Ruijie,,0-0-0-0-0-0-0-0-0-0-0-0-7-15-5-14
1034,60,6,"Same, RequestOtherPlayers()","And, can someone do something to prevent the win?",Inform([]),"No, there is nothing he/she can do.",Tianyi,5,5,Ruijie,,0-0-0-0-0-0-0-0-0-0-0-0-7-15-5-14
1034,60,7,RequestNewWinCondition(),Can you show me a new win pattern?,Inform,Assume you demonstrate this win condition,Tianyi,5,5,Ruijie,,0-0-12-0-0-0-14-0-0-0-11-0-0-0-15-0
1034,60,8,"Context Switch, Request(User_ID=1, Rotate)","Back to this board, can I rotate some pieces and still keep winning?",Inform([90]),"Yes, you can rotate all pieces 90 degrees to the rows and put them in the first column.",Tianyi,5,4,Ruijie,,11-0-0-0-0-16-0-0-0-0-4-0-0-0-0-3
1034,60,9,RequestNewWinCondition(),Can you show me another win pattern?,Inform,Assume you demonstrate this win condition,Tianyi,5,5,Ruijie,,10-0-0-0-0-4-0-0-0-0-16-0-0-0-0-8
1034,60,10,"Context Switch, Confirm(User_ID=1, AddPiece(3,2))","In this win, if I put a new piece at the third column of the upmost row, can it still be a win?",NotSure(),I cannot determine whether that is true.,Tianyi,5,4,Ruijie,,0-0-0-0-0-0-0-0-0-0-0-0-7-15-5-14
1034,60,11,"Context Switch, Request(User_ID=1, Translate)","For this board, can I move some pieces and still keep the win?","Inform(['row1', 'row2'])","Yes, you can either move all pieces to the second row or the third row.",Tianyi,5,5,Ruijie,,0-0-0-0-0-0-0-0-0-0-0-0-8-12-4-3
1034,60,12,"Context Switch, Confirm(User_ID=1, Height)","In this case, is it a win because some pieces are tall?",Negate(),"No, that is not the reason.",Tianyi,5,4,Ruijie,,0-0-0-0-0-0-0-0-0-0-0-0-7-15-5-14
1034,60,13,"Context Switch, Request(User_ID=1, Rotate)","In this win, can I rotate some pieces and still maintain the win?","Inform([45, 90])","Yes, you can rotate all pieces 45 degrees to the rows and put them in the diagonal, or you can rotate all pieces 90 degrees to the rows and put them in the first column.",Tianyi,5,4,Ruijie,,0-0-0-0-0-0-0-0-0-0-0-0-8-12-4-3
1034,60,14,RequestNewWinCondition(),Can you give me a new win?,Inform,Assume you demonstrate this win condition,Tianyi,5,4,Ruijie,,0-0-0-3-0-0-11-0-0-15-0-0-16-0-0-0
1034,60,15,Finish(),"Thank you so much, that is a great experience for me.",Finish,You are welcome.,Tianyi,5,5,Ruijie,,0-0-0-3-0-0-11-0-0-15-0-0-16-0-0-0
