dialog_id,CooperativityRate,Turn Exchange,Formal System Query,NL System Query,Formal User Response,User Response,NL_Student,Correctness Rate,Naturalness Rate,Evaluator,Comments,Board
777,60,0,Start(),Can you teach me how to play Quarto?,Start,"Sure, let's start.",Derek,5,5,Shaobo,,0-0-0-0-0-0-0-0-0-0-0-0-0-0-0-0
777,60,1,RequestNewWinCondition(),Can you show me a win condition to start?,Inform,Assume you demonstrate this win condition,Derek,5,5,Shaobo,,0-0-0-9-0-0-0-15-0-0-0-1-0-0-0-13
777,60,2,"Same, Confirm(User_ID=1, Hollowness)",Is the hollowness pattern the reason for this board to win?,Negate(),No. It is not the reason this board is winning.,Derek,5,5,Shaobo,,0-0-0-9-0-0-0-15-0-0-0-1-0-0-0-13
777,60,3,RequestNewWinCondition(),Can you show me one more winning board?,Inform,Assume you demonstrate this win condition,Derek,5,5,Shaobo,,0-0-0-0-0-0-0-0-0-0-0-0-7-9-5-11
777,60,4,RequestNewWinCondition(),Please show me one more win condition.,Inform,Assume you demonstrate this win condition,Derek,5,5,Shaobo,,0-0-0-0-0-0-0-0-0-0-0-0-2-4-8-5
777,60,5,"Context Switch, Confirm(User_ID=1, Color)","Go back to this board, is that a win because the color pattern of all pieces?",NotSure(),I am not sure about that.,Derek,5,5,Shaobo,,0-0-0-0-0-0-0-0-0-0-0-0-7-9-5-11
777,60,6,"Context Switch, Confirm(User_ID=1, Shape)","Moving to this board, is that a win because the shape pattern of all pieces?",Negate(),No. Their shape are not identical.,Derek,5,4,Shaobo,,0-0-0-9-0-0-0-15-0-0-0-1-0-0-0-13
777,60,7,"Same, Confirm(User_ID=1, Shape)",How about the shape?,Negate(),Still wrong.,Derek,5,5,Shaobo,,0-0-0-9-0-0-0-15-0-0-0-1-0-0-0-13
777,60,8,"Same, Request(User_ID=1, Translate)",How can I shift all pieces to different coloum?,"Inform(['col1', 'col2'])",You can place them to left by one or two.,Derek,5,5,Shaobo,,0-0-0-9-0-0-0-15-0-0-0-1-0-0-0-13
777,60,9,"Context Switch, Confirm(User_ID=1, Translate([1, 0]))","Switching to this board, can I shift all piece up by one?",Affirm(),Yes.,Derek,5,5,Shaobo,,0-0-0-0-0-0-0-0-0-0-0-0-2-4-8-5
777,60,10,Finish(),Thank you for teaching me today! ,Finish,Bye!,Derek,5,5,Shaobo,,0-0-0-0-0-0-0-0-0-0-0-0-2-4-8-5
