dialog_id,CooperativityRate,Turn Exchange,Formal System Query,NL System Query,Formal User Response,User Response,NL_Student,Correctness Rate,Naturalness Rate,Evaluator,Comments,Board
1242,60,0,Start(),"Hi, could you please tell me how to play Quarto?",Start,Sure!,Shaobo,5,5,John,,0-0-0-0-0-0-0-0-0-0-0-0-0-0-0-0
1242,60,1,RequestNewWinCondition(),Could you show me a win first?,Inform,Assume you demonstrate this win condition,Shaobo,5,5,John,,11-0-0-0-0-4-0-0-0-0-9-0-0-0-0-1
1242,60,2,RequestNewWinCondition(),Could you show me another winning board?,Inform,Assume you demonstrate this win condition,Shaobo,5,5,John,,0-0-15-0-0-0-12-0-0-0-10-0-0-0-16-0
1242,60,3,RequestNewWinCondition(),Could you show me one more winning board?,Inform,Assume you demonstrate this win condition,Shaobo,5,5,John,,0-0-5-0-0-0-10-0-0-0-1-0-0-0-6-0
1242,60,4,"Same, Confirm(User_ID=1, Quantity)",And does the number of pieces matter?,NotSure(),"Sorry, I am not sure about it.",Shaobo,5,4,John,,0-0-5-0-0-0-10-0-0-0-1-0-0-0-6-0
1242,60,5,"Context Switch, RequestOtherPlayers()","Switching to this board, how could another player revoke this win?",Inform([]),There is nothing that another player could do to prevent this win.,Shaobo,5,5,John,,0-0-15-0-0-0-12-0-0-0-10-0-0-0-16-0
1242,60,6,"Context Switch, Confirm(User_ID=1, Hollowness)","Switching to this board, is it a win because of the hollowness of the pieces?",Negate(),"No, it is a win because all pieces have the same shape.",Shaobo,5,5,John,,11-0-0-0-0-4-0-0-0-0-9-0-0-0-0-1
1242,60,7,"Same, Confirm(User_ID=1, Hollowness)",And is it a win because of the hollowness of the pieces?,NotSure(),I am not very sure this time.,Shaobo,5,5,John,,11-0-0-0-0-4-0-0-0-0-9-0-0-0-0-1
1242,60,8,"Context Switch, Confirm(User_ID=1, Color)","Switching to this board, is it a win because of the color of the pieces?",NotSure(),I don't think so but I am not sure.,Shaobo,4,4,John,,0-0-5-0-0-0-10-0-0-0-1-0-0-0-6-0
1242,60,9,"Context Switch, RequestOtherPlayers()","Switching to this board, how could another player revoke this win?",Inform([]),"There is nothing that another player could do to prevent this win.
",Shaobo,5,5,John,,11-0-0-0-0-4-0-0-0-0-9-0-0-0-0-1
1242,60,10,"Context Switch, Confirm(User_ID=1, AddPiece(0,0))","Switching to this board, is it still a win if I add a piece on the bottom left corner?",Affirm(),"Yes, it is still a win.",Shaobo,5,5,John,,0-0-15-0-0-0-12-0-0-0-10-0-0-0-16-0
1242,60,11,Finish(),Thanks for the help! I have learned a lot!,Finish,You are welcome!,Shaobo,5,5,John,,0-0-15-0-0-0-12-0-0-0-10-0-0-0-16-0
