dialog_id,CooperativityRate,Turn Exchange,Formal System Query,NL System Query,Formal User Response,User Response,NL_Student,Correctness Rate,Naturalness Rate,Evaluator,Comments,Board
647,60,0,Start(),"Hi, I want to learn Quarto, can you please teach me?",Start,"Sure, let's try!",Yiyan,5,5,Tianyi,,0-0-0-0-0-0-0-0-0-0-0-0-0-0-0-0
647,60,1,RequestNewWinCondition(),So can you first show me a win condition?,Inform,Assume you demonstrate this win condition,Yiyan,5,5,Tianyi,,13-0-0-0-0-14-0-0-0-0-15-0-0-0-0-9
647,60,2,RequestNewWinCondition(),Can you show me another win condition?,Inform,Assume you demonstrate this win condition,Yiyan,5,5,Tianyi,,2-0-0-0-0-10-0-0-0-0-4-0-0-0-0-1
647,60,3,RequestNewWinCondition(),Maybe one more?,Inform,Assume you demonstrate this win condition,Yiyan,5,5,Tianyi,,0-0-0-8-0-0-0-11-0-0-0-15-0-0-0-3
647,60,4,"Same, Confirm(User_ID=1, AddPiece(2,2))","For the third board you showed, will it still be a win if I add a piece on the third position of the third row?",Affirm(),"Yes, in that case you will get a new win.",Yiyan,5,5,Tianyi,,0-0-0-8-0-0-0-11-0-0-0-15-0-0-0-3
647,60,5,"Context Switch, Confirm(User_ID=1, Color)","Let's consider this board, is it a win because of the color of the pieces?",Negate(),"No, as you can see, there are multiple colors. The read reason is that all the pieces have the same shape.",Yiyan,5,5,Tianyi,,2-0-0-0-0-10-0-0-0-0-4-0-0-0-0-1
647,60,6,"Context Switch, Request(User_ID=1, Rotate)","For this board, how can I rotate the board while keeping the win?",Inform([90]),You can rotate the pieces to the last column.,Yiyan,5,5,Tianyi,,13-0-0-0-0-14-0-0-0-0-15-0-0-0-0-9
647,60,7,"Same, Confirm(User_ID=1, Hollowness)","For the same board, is it a win because one of the pieces has a hollow?",Negate(),"No, the hollowness does not matter here.",Yiyan,5,5,Tianyi,,13-0-0-0-0-14-0-0-0-0-15-0-0-0-0-9
647,60,8,"Context Switch, Confirm(User_ID=1, RemovePiece(1,2))","Regarding this win condition, will it still be a win if I remove the piece on the third column?",NotSure(),"I don't know, sorry.",Yiyan,5,5,Tianyi,,2-0-0-0-0-10-0-0-0-0-4-0-0-0-0-1
647,60,9,"Context Switch, Confirm(User_ID=1, AddPiece(0,2))","Let's switch to this board, will I get a new win if I add a piece left to the triangle piece?",Affirm(),"Yes, as long as you do not remove any other pieces.",Yiyan,5,5,Tianyi,,13-0-0-0-0-14-0-0-0-0-15-0-0-0-0-9
647,60,10,"Context Switch, Confirm(User_ID=1, Shape)","Considering this case, is it a win because of the shapes of the pieces?",NotSure(),"I do not quire sure, sorry.",Yiyan,5,5,Tianyi,,2-0-0-0-0-10-0-0-0-0-4-0-0-0-0-1
647,60,11,RequestNewWinCondition(),Is there any othey way to win?,Inform,Assume you demonstrate this win condition,Yiyan,5,5,Tianyi,,11-0-0-0-5-0-0-0-13-0-0-0-15-0-0-0
647,60,12,"Context Switch, Confirm(User_ID=1, AddPiece(1,1))","For this board, will it be another win if I add a piece left to the piece with a hollow?",Affirm(),"Yes, you will get another win then.",Yiyan,5,5,Tianyi,,2-0-0-0-0-10-0-0-0-0-4-0-0-0-0-1
647,60,13,RequestNewWinCondition(),Can you show me one more winning case?,Inform,Assume you demonstrate this win condition,Yiyan,5,5,Tianyi,,0-0-0-10-0-0-15-0-0-14-0-0-16-0-0-0
647,60,14,"Same, Confirm(User_ID=1, AddPiece(1,2))","For this winning case, will the result be changed if I add a piece below the green piece?",NotSure(),"Maybe, but I am not sure.",Yiyan,5,5,Tianyi,,0-0-0-10-0-0-15-0-0-14-0-0-16-0-0-0
647,60,15,Finish(),"Well, thank you very much for your help.",Finish,I am glad to help.,Yiyan,5,5,Tianyi,,0-0-0-10-0-0-15-0-0-14-0-0-16-0-0-0
