dialog_id,CooperativityRate,Turn Exchange,Formal System Query,NL System Query,Formal User Response,User Response,NL_Student,Correctness Rate,Naturalness Rate,Evaluator,Comments,Board
1027,60,0,Start(),"Hi, do you have time to teach me some rules about Quarto?",Start,No problem.,Tianyi,5,5,Ruijie,,0-0-0-0-0-0-0-0-0-0-0-0-0-0-0-0
1027,60,1,RequestNewWinCondition(),Can you show me a winning board?,Inform,Assume you demonstrate this win condition,Tianyi,5,5,Ruijie,,0-0-0-2-0-0-12-0-0-3-0-0-4-0-0-0
1027,60,2,RequestNewWinCondition(),Can you show me another winning board?,Inform,Assume you demonstrate this win condition,Tianyi,5,5,Ruijie,,0-0-0-11-0-0-0-1-0-0-0-2-0-0-0-4
1027,60,3,RequestNewWinCondition(),Can you show me a new win pattern?,Inform,Assume you demonstrate this win condition,Tianyi,5,5,Ruijie,,0-0-0-0-0-0-0-0-0-0-0-0-2-14-5-9
1027,60,4,"Context Switch, Confirm(User_ID=1, AddPiece(2,0))","In this winning board, if I put a new piece at the first column of the third row, can it still be a win?",Affirm(),"Yes, you can put the new piece anywhere.",Tianyi,5,4,Ruijie,,0-0-0-2-0-0-12-0-0-3-0-0-4-0-0-0
1027,60,5,RequestNewWinCondition(),Can you show me another new win pattern?,Inform,Assume you demonstrate this win condition,Tianyi,5,5,Ruijie,,0-0-0-0-0-0-0-0-0-0-0-0-1-11-13-15
1027,60,6,"Same, Confirm(User_ID=1, Shape)","In this board, is it wins because some pieces have the same shape?",Negate(),"No, that is not the reason.",Tianyi,5,5,Ruijie,,0-0-0-0-0-0-0-0-0-0-0-0-1-11-13-15
1027,60,7,"Same, Request(User_ID=1, Translate)",Can I move some pieces and still keep the win?,"Inform(['row1', 'row2'])","Yes, you can either move all pieces to the second row or the third row.",Tianyi,5,5,Ruijie,,0-0-0-0-0-0-0-0-0-0-0-0-1-11-13-15
1027,60,8,"Context Switch, Request(User_ID=1, Translate)","For this board, can I move some pieces and still keep the win?",Inform(['col1']),"Yes, you can move all pieces to the second column.",Tianyi,5,5,Ruijie,,0-0-0-11-0-0-0-1-0-0-0-2-0-0-0-4
1027,60,9,"Context Switch, RequestOtherPlayers()","In this board, can someone do something to prevent the win?",Inform([]),"No, there is nothing he/she can do.",Tianyi,5,4,Ruijie,,0-0-0-0-0-0-0-0-0-0-0-0-2-14-5-9
1027,60,10,RequestNewWinCondition(),Can you give me a new win?,Inform,Assume you demonstrate this win condition,Tianyi,5,5,Ruijie,,12-0-0-0-0-9-0-0-0-0-16-0-0-0-0-14
1027,60,11,"Same, Confirm(User_ID=1, Color)","For this board, is it wins because most pieces are blue?",Negate(),No.,Tianyi,5,5,Ruijie,,12-0-0-0-0-9-0-0-0-0-16-0-0-0-0-14
1027,60,12,"Context Switch, Confirm(User_ID=1, AddPiece(3,2))","In this winning board, if I put a new piece at the third column of the top row, can it still be a win?",NotSure(),I am uncertain about this.,Tianyi,5,4,Ruijie,,0-0-0-11-0-0-0-1-0-0-0-2-0-0-0-4
1027,60,13,Finish(),"Thanks, very great learning experience.",Finish,You are welcome.,Tianyi,5,5,Ruijie,,0-0-0-11-0-0-0-1-0-0-0-2-0-0-0-4
