dialog_id,CooperativityRate,Turn Exchange,Formal System Query,NL System Query,Formal User Response,User Response,NL_Student,Correctness Rate,Naturalness Rate,Evaluator,Comments,Board
78,100,0,Start(),"Howdy partner, I'm here for my Quarto lesson.",Start,Giddy up!,Dave,5,5,Dmytro,,0-0-0-0-0-0-0-0-0-0-0-0-0-0-0-0
78,100,1,RequestNewWinCondition(),Show may one way I might win.,Inform(),Assume you demonstrate this win condition,Dave,5,4,Dmytro,I assigned different score in a previous file but I changed my mind on this.,4-0-0-0-0-16-0-0-0-0-7-0-0-0-0-12
78,100,2,"Same, Request(User_ID=1, Translate)",Where else on the board could I lay down this sequence of pieces diagonally and have a win?,Inform([]),"In fact, there is no other way to do so.",Dave,5,4,Dmytro,"While correct, I think this can be expressed in a better way.",4-0-0-0-0-16-0-0-0-0-7-0-0-0-0-12
78,100,3,RequestNewWinCondition(),Can you show me another?,Inform(),Assume you demonstrate this win condition,Dave,3,2,Dmytro,Another translate ? not clear from the context,0-0-4-0-0-0-5-0-0-0-2-0-0-0-8-0
78,100,4,RequestNewWinCondition(),And another?,Inform(),Assume you demonstrate this win condition,Dave,5,5,Dmytro,"Assuming the previous query is formed in a correct manner, this is acceptable.",2-0-0-0-0-1-0-0-0-0-4-0-0-0-0-9
78,100,5,"Context Switch, Confirm(User_ID=1, Quantity)","In the second example you showed me, is it necessary to have four and only four pieces?",Affirm(),That's right.,Dave,5,5,Dmytro,,0-0-4-0-0-0-5-0-0-0-2-0-0-0-8-0
78,100,6,RequestNewWinCondition(),Can you show me another example?,Inform(),Assume you demonstrate this win condition,Dave,4,3,Dmytro,'board' example is better in my opinion.,0-0-0-0-0-0-0-0-0-0-0-0-7-9-11-15
78,100,7,"Same, Request(User_ID=1, Translate)",Where else can I place this sequence of pieces from left to right and get a win?,"Inform(['row1', 'row2', 'row3'])",You can place them in any of the three remaining empty rows and still get a win.,Dave,5,5,Dmytro,,0-0-0-0-0-0-0-0-0-0-0-0-7-9-11-15
78,100,8,"Same , Confirm(User_ID=1, AddPiece(1,1))",Would I still get a win even if I add a piece above the solid green triangle?,Affirm(),"Right, it wouldn't affect your win.",Dave,5,5,Dmytro,,0-0-0-0-0-0-0-0-0-0-0-0-7-9-11-15
78,100,9,"Context Switch, RequestOtherPlayers()","In the first example you showed me, can you make a move to reverse my win?",Inform([]),"No, there's nothing I can do to sabotage you!",Dave,5,4,Dmytro,'reversing' a win may not be quite natural,4-0-0-0-0-16-0-0-0-0-7-0-0-0-0-12
78,100,10,Finish(),"Okay, that's enough for now. Thanks!",Finish,No problem. Bye!,Dave,5,5,Dmytro,,4-0-0-0-0-16-0-0-0-0-7-0-0-0-0-12
