dialog_id,CooperativityRate,Turn Exchange,Formal System Query,NL System Query,Formal User Response,User Response,NL_Student,Correctness Rate,Naturalness Rate,Evaluator,Comments,Board
600,60,0,Start(),"Hello, are you willing to teach me how to play Quarto?",Start,"Sure, let's begin.",Yiyan,5,5,Tianyi,,0-0-0-0-0-0-0-0-0-0-0-0-0-0-0-0
600,60,1,RequestNewWinCondition(),"Thank you. Firstly, could you demostrate a win condition?",Inform,Assume you demonstrate this win condition,Yiyan,5,5,Tianyi,,0-0-0-0-0-0-0-0-0-0-0-0-7-6-2-3
600,60,2,"Same, Confirm(User_ID=1, Quantity)","For the win you just showed
, is it a win because of the number of the pieces?",NotSure(),I dare say that.,Yiyan,5,5,Tianyi,,0-0-0-0-0-0-0-0-0-0-0-0-7-6-2-3
600,60,3,RequestNewWinCondition(),Is there any other way to win the game?,Inform,Assume you demonstrate this win condition,Yiyan,5,5,Tianyi,,0-5-0-0-0-1-0-0-0-6-0-0-0-13-0-0
600,60,4,RequestNewWinCondition(),Could you please show me one more win scenario?,Inform,Assume you demonstrate this win condition,Yiyan,5,5,Tianyi,,0-0-0-0-0-0-0-0-0-0-0-0-2-4-8-14
600,60,5,"Context Switch, Confirm(User_ID=1, Height)","Let's turn to this board, is it a win because of the heights of the pieces?",Negate(),"No, it is a win because all the pieces are solid.",Yiyan,5,5,Tianyi,,0-5-0-0-0-1-0-0-0-6-0-0-0-13-0-0
600,60,6,"Context Switch, Confirm(User_ID=1, RemovePiece(0,1))","Let's consider this board, would it be another win if I get rid of the piece on the second column?",Negate(),"No, it wouldn't since all the pieces on this board are necessary to the win.",Yiyan,5,5,Tianyi,,0-0-0-0-0-0-0-0-0-0-0-0-7-6-2-3
600,60,7,"Same, Request(User_ID=1, Rotate)","For the same board,  how can I rotate the pieces while keeping the win condition?","Inform([45, 90])",You can totate the pieces to the diagonal direction or to the first column.,Yiyan,5,5,Tianyi,,0-0-0-0-0-0-0-0-0-0-0-0-7-6-2-3
600,60,8,RequestNewWinCondition(),Can you show me another way to win the game?,Inform,Assume you demonstrate this win condition,Yiyan,5,5,Tianyi,,0-0-0-12-0-0-11-0-0-9-0-0-13-0-0-0
600,60,9,RequestNewWinCondition(),Could you please show me one more win case?,Inform,Assume you demonstrate this win condition,Yiyan,5,5,Tianyi,,0-0-0-0-0-0-0-0-0-0-0-0-5-6-1-13
600,60,10,"Same, Confirm(User_ID=1, Shape)","For the win you just showed, do the shapes of the pieces relate to the win?",Negate(),"No, the shapes of the pieces do not matter here.",Yiyan,5,5,Tianyi,,0-0-0-0-0-0-0-0-0-0-0-0-5-6-1-13
600,60,11,"Context Switch, RequestOtherPlayers()","Let's consider this board, how can the other player do to prevent the win?",Inform([]),There is nothing the other player can do.,Yiyan,5,5,Tianyi,,0-5-0-0-0-1-0-0-0-6-0-0-0-13-0-0
600,60,12,"Same, RequestOtherPlayers()","For the same board, how can the other player do to stop my win?",Inform([]),"I think you are asking the same question. As I said, there is nothing the other player can do.",Yiyan,5,5,Tianyi,,0-5-0-0-0-1-0-0-0-6-0-0-0-13-0-0
600,60,13,"Same, Confirm(User_ID=1, Shape)","For the same board, it is a win because of the shapes of the pieces?",Negate(),"No, it is a win because all the pieces are solid.",Yiyan,5,5,Tianyi,,0-5-0-0-0-1-0-0-0-6-0-0-0-13-0-0
600,60,14,"Context Switch, Confirm(User_ID=1, AddPiece(1,2))","Let's turn to this board, would it be a new win condition if I add a piece on the third postion of the second row?",Affirm(),"Yes, it would.",Yiyan,5,5,Tianyi,,0-0-0-0-0-0-0-0-0-0-0-0-5-6-1-13
600,60,15,Finish(),"Thank you very much, I learned a lot today.",Finish,I am glad to help.,Yiyan,5,5,Tianyi,,0-0-0-0-0-0-0-0-0-0-0-0-5-6-1-13
