dialog_id,CooperativityRate,Turn Exchange,Formal System Query,NL System Query,Formal User Response,User Response,NL_Student,Correctness Rate,Naturalness Rate,Evaluator,Comments,Board
181,100,0,Start(),May I know how to play Quarto?,Start,Sure!,Shaobo,3,1,Anthony,,0-0-0-0-0-0-0-0-0-0-0-0-0-0-0-0
181,100,1,RequestNewWinCondition(),Could you show me a win?,Inform(),Assume you demonstrate this win condition,Shaobo,5,5,Anthony,,7-0-0-0-4-0-0-0-11-0-0-0-8-0-0-0
181,100,2,"Same, Confirm(User_ID=1, Quantity)",Does the number of pieces on the board affect the win?,Affirm(),"Yes, you need at least four pieces for a win.",Shaobo,5,5,Anthony,,7-0-0-0-4-0-0-0-11-0-0-0-8-0-0-0
181,100,3,"Same, RequestOtherPlayers()",And what actions could another player take to revoke this win?,Inform([]),There is nothing that he or she could do to revoke the win.,Shaobo,5,5,Anthony,,7-0-0-0-4-0-0-0-11-0-0-0-8-0-0-0
181,100,4,RequestNewWinCondition(),Could you show me one more win condition?,Inform(),Assume you demonstrate this win condition,Shaobo,5,5,Anthony,,10-0-0-0-0-4-0-0-0-0-12-0-0-0-0-14
181,100,5,RequestNewWinCondition(),Is there any other way to win?,Inform(),Assume you demonstrate this win condition,Shaobo,4,5,Anthony,,12-0-0-0-2-0-0-0-11-0-0-0-3-0-0-0
181,100,6,"Context Switch, Confirm(User_ID=1, Height)","For this board, is it a win because of the heights of the pieces?",Negate(),"No, it is a win because all pieces are hollow.",Shaobo,5,5,Anthony,,7-0-0-0-4-0-0-0-11-0-0-0-8-0-0-0
181,100,7,"Same, Request(User_ID=1, Rotate)",And how could I rotate the board so that it is still a win?,"Inform([0, 45])",You could rotate the pieces either to the bottom row or to the diagonal.,Shaobo,5,5,Anthony,,7-0-0-0-4-0-0-0-11-0-0-0-8-0-0-0
181,100,8,"Context Switch, Confirm(User_ID=1, Shape)","For this board, is it a win because of the shapes of the pieces?",Negate(),"No, it is win because all pieces are blue.",Shaobo,5,5,Anthony,,10-0-0-0-0-4-0-0-0-0-12-0-0-0-0-14
181,100,9,RequestNewWinCondition(),Can you show me another win condition?,Inform(),Assume you demonstrate this win condition,Shaobo,5,5,Anthony,,0-0-16-0-0-0-2-0-0-0-12-0-0-0-14-0
181,100,10,"Context Switch, Confirm(User_ID=1, Rotate(90))","For this board, is it still a win if I rotate the pieces to the first column?",Affirm(),"Yes, it is still a win.",Shaobo,5,5,Anthony,,10-0-0-0-0-4-0-0-0-0-12-0-0-0-0-14
181,100,11,"Context Switch, RequestOtherPlayers()","For this board, what actions could another player take to revoke this win?",Inform([]),There is nothing that he or she could do to revoke the win.,Shaobo,5,5,Anthony,,12-0-0-0-2-0-0-0-11-0-0-0-3-0-0-0
181,100,12,"Context Switch, Confirm(User_ID=1, AddPiece(2,2))","For this board, is it still a win if I add a piece to the third column and the third row?",Affirm(),"Yes, it is still a win.",Shaobo,1,5,Anthony,does not follow previous convention.,7-0-0-0-4-0-0-0-11-0-0-0-8-0-0-0
181,100,13,"Context Switch, Confirm(User_ID=1, RemovePiece(0,0))","For this board, is it still a win if I remove the piece on the first row and the first column?",Negate(),"No, it will not a win anymore.",Shaobo,5,5,Anthony,the coorddinates are not clear. In previous dialgogs 1 reffered to the first now 0 does. Making 1 refer to the second.,12-0-0-0-2-0-0-0-11-0-0-0-3-0-0-0
181,100,14,"Context Switch, Confirm(User_ID=1, Height)","For this board, is it still a win because of the height of the pieces?",Negate(),"No, it is a win because all pieces are blue.",Shaobo,5,4,Anthony,,0-0-16-0-0-0-2-0-0-0-12-0-0-0-14-0
181,100,15,Finish(),Thanks! I have learned a lot!,Finish,You are welcome!,Shaobo,5,5,Anthony,,0-0-16-0-0-0-2-0-0-0-12-0-0-0-14-0
