dialog_id,CooperativityRate,Turn Exchange,Formal System Query,NL System Query,Formal User Response,User Response,NL_Student,Correctness Rate,Naturalness Rate,Evaluator,Comments,Board
148,100,0,Start(),Hey can you teach me how to play Quarto?,Start,Sure!,Derek,5,5,John,,0-0-0-0-0-0-0-0-0-0-0-0-0-0-0-0
148,100,1,RequestNewWinCondition(),Can you give me a win condition to start with?,Inform(),Assume you demonstrate this win condition,Derek,5,5,John,,0-0-0-15-0-0-0-5-0-0-0-8-0-0-0-13
148,100,2,RequestNewWinCondition(),Please show me one more win condition.,Inform(),Assume you demonstrate this win condition,Derek,5,5,John,,0-0-0-3-0-0-7-0-0-6-0-0-1-0-0-0
148,100,3,"Same, Confirm(User_ID=1, Height)",Is that a win because the height of every piece?,Affirm(),Yes.,Derek,5,4,John,maybe elaborate a bit more in the user response,0-0-0-3-0-0-7-0-0-6-0-0-1-0-0-0
148,100,4,"Same , Confirm(User_ID=1, Color)",Is the color of pieces the reason to win?,Negate(),No.,Derek,5,4,John,,0-0-0-3-0-0-7-0-0-6-0-0-1-0-0-0
148,100,5,"Same, Confirm(User_ID=1, Height)",How about the height of every piece?,Affirm(),"Well, I just told you it's the reason to win.",Derek,5,5,John,"This does seem like a natural conversation (with memory), I like it",0-0-0-3-0-0-7-0-0-6-0-0-1-0-0-0
148,100,6,RequestNewWinCondition(),"Okey, can you give me another win condition?",Inform(),Assume you demonstrate this win condition,Derek,5,5,John,,0-0-0-8-0-0-0-1-0-0-0-3-0-0-0-2
148,100,7,"Same , Confirm(User_ID=1, AddPiece(1,0))","Can I add a piece at (1,0) and keep winning?",Affirm(),"Yes, you can do that.",Derek,5,2,John,Coordinates in a tuple doesn't seem natural,0-0-0-8-0-0-0-1-0-0-0-3-0-0-0-2
148,100,8,"Context Switch, RequestOtherPlayers()","Let's go back to the second win condition, can another player prevent that win?",Inform([]),No.,Derek,4,5,John,"Instead of asking it as a yes or no question, try to ask ""how"" can another player prevent it",0-0-0-3-0-0-7-0-0-6-0-0-1-0-0-0
148,100,9,"Context Switch, Confirm(User_ID=1, Shape)","For the last win condition you showed me, is that a win because the shape of pieces?",Negate(),No.,Derek,5,4,John,,0-0-0-8-0-0-0-1-0-0-0-3-0-0-0-2
148,100,10,"Context Switch, Confirm(User_ID=1, RemovePiece(0,0))","For the second win condition, can I remove the piece at bottom left and keep winning?",Negate(),"No, it will no loger be a win.",Derek,5,5,John,,0-0-0-3-0-0-7-0-0-6-0-0-1-0-0-0
148,100,11,Finish(),Thanks! I learned a lot today.,Finish,No problem!,Derek,5,5,John,,0-0-0-3-0-0-7-0-0-6-0-0-1-0-0-0
