dialog_id,CooperativityRate,Turn Exchange,Formal System Query,NL System Query,Formal User Response,User Response,NL_Student,Correctness Rate,Naturalness Rate,Evaluator,Comments,Board
750,60,0,Start(),"Hey, can you play Quarto with me? I want to learn how to play!",Start,"Sure, let's do it!",Ruijie,5,5,Luke,,0-0-0-0-0-0-0-0-0-0-0-0-0-0-0-0
750,60,1,RequestNewWinCondition(),Can you show me a win condition?,Inform,Assume you demonstrate this win condition,Ruijie,5,5,Luke,,16-0-0-0-0-12-0-0-0-0-11-0-0-0-0-13
750,60,2,"Same, Confirm(User_ID=1, Height)",Is it a win because the pieces are of the same height?,Affirm(),"Yes, that's correct!",Ruijie,5,5,Luke,,16-0-0-0-0-12-0-0-0-0-11-0-0-0-0-13
750,60,3,RequestNewWinCondition(),Can you show me a win condition?,Inform,Assume you demonstrate this win condition,Ruijie,5,5,Luke,,0-0-0-13-0-0-14-0-0-9-0-0-11-0-0-0
750,60,4,"Context Switch, Confirm(User_ID=1, AddPiece(2,2))","Switch to this board, can I add one more piece on the third row, the third column?",Affirm(),"Sure, you can do that.",Ruijie,4,4,Luke,,16-0-0-0-0-12-0-0-0-0-11-0-0-0-0-13
750,60,5,"Context Switch, Request(User_ID=1, Rotate)","Switch to this board, can I rotate the pieces by some degrees?",Inform([90]),Yup. You can rotate them by ninety degrees.,Ruijie,4,4,Luke,,0-0-0-13-0-0-14-0-0-9-0-0-11-0-0-0
750,60,6,"Context Switch, RequestOtherPlayers()","Switch to this board, can the other player undo this win?",Inform([]),"No, this win is absolute.",Ruijie,5,5,Luke,,16-0-0-0-0-12-0-0-0-0-11-0-0-0-0-13
750,60,7,"Same, Confirm(User_ID=1, Shape)","Is it a win because the pieces are of the same shape?
",Negate(),"No, it’s irrelevant.",Ruijie,5,5,Luke,,16-0-0-0-0-12-0-0-0-0-11-0-0-0-0-13
750,60,8,"Context Switch, Confirm(User_ID=1, AddPiece(2,3))","Switch to this board, can I add one more piece on the third row, the fourth column?",Affirm(),"Sure, you can do that.",Ruijie,4,4,Luke,,0-0-0-13-0-0-14-0-0-9-0-0-11-0-0-0
750,60,9,"Context Switch, Confirm(User_ID=1, Shape)","Switch to this board, is it a win because the pieces are of the same shape?",Negate(),"No, that’s not the reason.",Ruijie,5,5,Luke,,16-0-0-0-0-12-0-0-0-0-11-0-0-0-0-13
750,60,10,Finish(),Thank you so much! I've learned a lot!,Finish,"Ok, we can do it again anytime!",Ruijie,5,5,Luke,,16-0-0-0-0-12-0-0-0-0-11-0-0-0-0-13
