dialog_id,CooperativityRate,Turn Exchange,Formal System Query,NL System Query,Formal User Response,User Response,NL_Student,Correctness Rate,Naturalness Rate,Evaluator,Comments,Board
674,60,0,Start(),"Hi, I want to learn how to play Quarto.",Start,"Well, I'm the right person to ask!",Ruijie,5,5,Luke,,0-0-0-0-0-0-0-0-0-0-0-0-0-0-0-0
674,60,1,RequestNewWinCondition(),Can you show me a win condition?,Inform,Assume you demonstrate this win condition,Ruijie,5,5,Luke,,0-0-0-16-0-0-0-13-0-0-0-9-0-0-0-10
674,60,2,"Same, RequestOtherPlayers()",Can the other player undo this win?,Inform([]),"No, this win is absolute.",Ruijie,5,5,Luke,,0-0-0-16-0-0-0-13-0-0-0-9-0-0-0-10
674,60,3,"Same, Confirm(User_ID=1, Height)",Is it a win becasue of the height of pieces?,NotSure(),I'm actually not sure.,Ruijie,5,5,Luke,,0-0-0-16-0-0-0-13-0-0-0-9-0-0-0-10
674,60,4,RequestNewWinCondition(),Can you show me a new win condition?,Inform,Assume you demonstrate this win condition,Ruijie,5,5,Luke,,0-0-9-0-0-0-7-0-0-0-15-0-0-0-11-0
674,60,5,"Same, Confirm(User_ID=1, Color)",Is it a win because the pieces are in the same color?,Affirm(),"Yes, that's correct.",Ruijie,5,5,Luke,,0-0-9-0-0-0-7-0-0-0-15-0-0-0-11-0
674,60,6,RequestNewWinCondition(),Can you show me a win condition?,Inform,Assume you demonstrate this win condition,Ruijie,5,5,Luke,,0-0-0-0-0-0-0-0-0-0-0-0-12-16-13-15
674,60,7,RequestNewWinCondition(),Can you show me a win condition?,Inform,Assume you demonstrate this win condition,Ruijie,5,4,Luke,,10-0-0-0-0-1-0-0-0-0-3-0-0-0-0-11
674,60,8,"Context Switch, Confirm(User_ID=1, Height)","Switch to this win, is it a win because the pieces are of the same height?",NotSure(),You know what? I'm not sure.,Ruijie,5,5,Luke,,0-0-0-0-0-0-0-0-0-0-0-0-12-16-13-15
674,60,9,"Context Switch, Confirm(User_ID=1, Height)","Switch to this win, is it a win because of the height of pieces?",NotSure(),I'm not sure.,Ruijie,5,5,Luke,,0-0-0-16-0-0-0-13-0-0-0-9-0-0-0-10
674,60,10,"Context Switch, RequestOtherPlayers()","Switch to this win, can the other player undo this win?",Inform([]),"No, this win is absolute.",Ruijie,5,5,Luke,,10-0-0-0-0-1-0-0-0-0-3-0-0-0-0-11
674,60,11,Finish(),Thank you!,Finish,You're welcome.,Ruijie,5,5,Luke,,10-0-0-0-0-1-0-0-0-0-3-0-0-0-0-11
