dialog_id,CooperativityRate,Turn Exchange,Formal System Query,NL System Query,Formal User Response,User Response,NL_Student,Correctness Rate,Naturalness Rate,Evaluator,Comments,Board
1212,60,0,Start(),"Hi, could you teach me how to play Quarto?",Start,"Sure, let's get started!",Shaobo,5,5,John,,0-0-0-0-0-0-0-0-0-0-0-0-0-0-0-0
1212,60,1,RequestNewWinCondition(),Could you show me a win first?,Inform,Assume you demonstrate this win condition,Shaobo,5,5,John,,0-0-0-0-0-0-0-0-0-0-0-0-3-12-7-16
1212,60,2,"Same, Confirm(User_ID=1, Quantity)",Does the number of pieces matter?,Affirm(),"Yes, you need at least four pieces for a win.",Shaobo,5,5,John,,0-0-0-0-0-0-0-0-0-0-0-0-3-12-7-16
1212,60,3,RequestNewWinCondition(),Is there any other way to win?,Inform,Assume you demonstrate this win condition,Shaobo,5,5,John,,0-0-0-0-0-0-0-0-0-0-0-0-4-10-12-1
1212,60,4,"Context Switch, Confirm(User_ID=1, Translate([3, 0]))","Switching to this board, is it still a win if I shift the pieces to the top row?",NotSure(),"Sorry, I am not sure about it.",Shaobo,5,4,John,,0-0-0-0-0-0-0-0-0-0-0-0-3-12-7-16
1212,60,5,"Context Switch, Confirm(User_ID=1, RemovePiece(0,1))","Switching to this board, is it still a win if I remove the blue solid piece?",Negate(),"No, you need at least four pieces for a win.",Shaobo,5,5,John,,0-0-0-0-0-0-0-0-0-0-0-0-4-10-12-1
1212,60,6,"Context Switch, RequestOtherPlayers()","Switching to this board, how could another player revoke this win?",Inform([]),There is nothing that another player could do to prevent this win.,Shaobo,5,5,John,,0-0-0-0-0-0-0-0-0-0-0-0-3-12-7-16
1212,60,7,"Context Switch, Confirm(User_ID=1, Rotate(45))","Switching to this board, is it still a win if I rotate the pieces to the diagonal?",Affirm(),"Yes, it is still a win.",Shaobo,5,5,John,,0-0-0-0-0-0-0-0-0-0-0-0-4-10-12-1
1212,60,8,RequestNewWinCondition(),Could you show me one more winning board?,Inform,Assume you demonstrate this win condition,Shaobo,5,5,John,,14-0-0-0-0-2-0-0-0-0-4-0-0-0-0-10
1212,60,9,"Context Switch, Confirm(User_ID=1, Quantity)","Switching to this board, does the number of pieces matter?",NotSure(),"Sorry, I am not sure about it.",Shaobo,5,4,John,,0-0-0-0-0-0-0-0-0-0-0-0-4-10-12-1
1212,60,10,Finish(),Thanks for the help! I have learned a lot!,Finish,You are welcome!,Shaobo,5,5,John,,0-0-0-0-0-0-0-0-0-0-0-0-4-10-12-1
