dialog_id,CooperativityRate,Turn Exchange,Formal System Query,NL System Query,Formal User Response,User Response,NL_Student,Correctness Rate,Naturalness Rate,Evaluator,Comments,Board
967,60,0,Start(),"Hi, can you teach me how to play Quarto?",Start,"Ok, let's start.",Tianyi,,,,,0-0-0-0-0-0-0-0-0-0-0-0-0-0-0-0
967,60,1,RequestNewWinCondition(),Can you show me a win pattern?,Inform,Assume you demonstrate this win condition,Tianyi,,,,,0-0-4-0-0-0-12-0-0-0-11-0-0-0-16-0
967,60,2,"Same, Confirm(User_ID=1, AddPiece(0,1))","In this win, if I add a piece at the second column of the bottom row, can it still be a win?",Affirm(),Yes.,Tianyi,,,,,0-0-4-0-0-0-12-0-0-0-11-0-0-0-16-0
967,60,3,RequestNewWinCondition(),Can you show me another win pattern?,Inform,Assume you demonstrate this win condition,Tianyi,,,,,0-0-0-0-0-0-0-0-0-0-0-0-15-11-9-1
967,60,4,"Context Switch, Confirm(User_ID=1, AddPiece(0,1))","In that board, if I add a piece at the second column of the first row, can it still be a win?",Affirm(),"Yes, it will still be a win.",Tianyi,,,,,0-0-4-0-0-0-12-0-0-0-11-0-0-0-16-0
967,60,5,"Context Switch, Confirm(User_ID=1, Shape)","In this case, is it a win because some pieces have the same shape?",NotSure(),"Sorry, I am not sure about this.",Tianyi,,,,,0-0-0-0-0-0-0-0-0-0-0-0-15-11-9-1
967,60,6,"Context Switch, Confirm(User_ID=1, RemovePiece(0,2))","In this win, if I remove the piece at the bottom row, is it still a win?",NotSure(),I am uncertain about this. Maybe you are right.,Tianyi,,,,,0-0-4-0-0-0-12-0-0-0-11-0-0-0-16-0
967,60,7,"Context Switch, Confirm(User_ID=1, Color)","In this board, is it wins because all pieces are green?",Affirm(),"Yes, that is.",Tianyi,,,,,0-0-0-0-0-0-0-0-0-0-0-0-15-11-9-1
967,60,8,"Context Switch, Confirm(User_ID=1, Shape)","For this win pattern, is it a win because some pieces have the same shape?",NotSure(),I cannot determine whether that is true.,Tianyi,,,,,0-0-4-0-0-0-12-0-0-0-11-0-0-0-16-0
967,60,9,"Context Switch, Confirm(User_ID=1, Hollowness)","In that board, it wins because some pieces are solid right?",Negate(),Nope.,Tianyi,,,,,0-0-0-0-0-0-0-0-0-0-0-0-15-11-9-1
967,60,10,"Same, Confirm(User_ID=1, RemovePiece(0,0))","And, if I remove the piece at the first column, can it still be a win?",Negate(),"No, it is no longer a win if you do that.",Tianyi,,,,,0-0-0-0-0-0-0-0-0-0-0-0-15-11-9-1
967,60,11,RequestNewWinCondition(),Can you give me a new example of win?,Inform,Assume you demonstrate this win condition,Tianyi,,,,,0-3-0-0-0-12-0-0-0-2-0-0-0-10-0-0
967,60,12,Finish(),Thank you so much.,Finish,No problem.,Tianyi,,,,,0-3-0-0-0-12-0-0-0-2-0-0-0-10-0-0
