dialog_id,CooperativityRate,Turn Exchange,Formal System Query,NL System Query,Formal User Response,User Response,NL_Student,Correctness Rate,Naturalness Rate,Evaluator,Comments,Board
254,100,0,Start(),"Hello, can you teach me how to play Quarto?",Start,Sure.,Tianyi,5,5,Jacob,,0-0-0-0-0-0-0-0-0-0-0-0-0-0-0-0
254,100,1,RequestNewWinCondition(),Can you show me a win pattern?,Inform(),Assume you demonstrate this win condition,Tianyi,5,5,Jacob,,0-0-0-0-0-0-0-0-0-0-0-0-12-3-4-7
254,100,2,RequestNewWinCondition(),Can you show another win case?,Inform(),Assume you demonstrate this win condition,Tianyi,5,5,Jacob,,0-0-0-0-0-0-0-0-0-0-0-0-4-2-3-12
254,100,3,"Same , Confirm(User_ID=1, Color)","So, is it a win because of the colors of pieces.",Negate(),"No, the color here does not play a role for the win.",Tianyi,5,5,Jacob,,0-0-0-0-0-0-0-0-0-0-0-0-4-2-3-12
254,100,4,"Same, Confirm(User_ID=1, Rotate(45))","If I rotate all pieces by 45 degrees and put them in the diagonal from bottom left to up right, can it still be a win?",Affirm(),"Yes, that should still be a win here.",Tianyi,4,5,Jacob,The pieces don't need to be individually rotated.,0-0-0-0-0-0-0-0-0-0-0-0-4-2-3-12
254,100,5,"Context Switch, Confirm(User_ID=1, Color)","In that case, that win should because of the colors of the pieces right?",Negate(),"Nope, the color here is unrelated to the win.",Tianyi,5,4,Jacob,"Insert ""be"" between ""win"" and ""should.""",0-0-0-0-0-0-0-0-0-0-0-0-12-3-4-7
254,100,6,RequestNewWinCondition(),Can you show a new win pattern?,Inform(),Assume you demonstrate this win condition,Tianyi,5,5,Jacob,,0-0-2-0-0-0-5-0-0-0-6-0-0-0-14-0
254,100,7,"Same , Confirm(User_ID=1, Color)","How about in that case, is the color of pieces here the reason of win?",Negate(),"No, the color here is still not the reason.",Tianyi,5,4,Jacob,"replace ""reason of win"" with ""reason this wins,"" or ""reason for the win.""",0-0-2-0-0-0-5-0-0-0-6-0-0-0-14-0
254,100,8,"Win Same {'ActionName': 'Confirm_Hollowness', 'FirstPart': None, 'ID': 1, 'SecondPart': None}","So, that win is because all pieces are solid right?",Affirm(),"Yes, that is.",Tianyi,5,5,Jacob,,0-0-2-0-0-0-5-0-0-0-6-0-0-0-14-0
254,100,9,"Same , Confirm(User_ID=1, AddPiece(2,1))","And, if I add a piece at the third row of second column, it will still be a win right?",Affirm(),"Yes, the board here is still a win.",Tianyi,5,5,Jacob,,0-0-2-0-0-0-5-0-0-0-6-0-0-0-14-0
254,100,10,RequestNewWinCondition(),What else can be a win?,Inform(),Assume you demonstrate this win condition,Tianyi,5,5,Jacob,,0-0-0-2-0-0-13-0-0-1-0-0-10-0-0-0
254,100,11,RequestNewWinCondition(),Can you give me more cases of win? That game still doesn't make sense to me.,Inform(),Assume you demonstrate this win condition,Tianyi,5,4,Jacob,"Replace ""cases of win"" with ""win conditions.""",0-0-0-0-0-0-0-0-0-0-0-0-8-4-2-3
254,100,12,"Context Switch, Confirm(User_ID=1, Height)","Still in that case, is that a win because some pieces are tall?",Negate(),"No, the reason here is not this.",Tianyi,5,4,Jacob,,0-0-0-0-0-0-0-0-0-0-0-0-12-3-4-7
254,100,13,Finish(),"I can't say I master the game, but I learned a lot of new thing. Thank you.",Finish,"Sure, I can tell you more, if you still have something not clear.",Tianyi,4,3,Jacob,"Finish should have more finality to it. Also, replace ""I master"" with ""I've mastered"" and ""thing"" with ""things.""",0-0-0-0-0-0-0-0-0-0-0-0-12-3-4-7
