dialog_id,CooperativityRate,Turn Exchange,Formal System Query,NL System Query,Formal User Response,User Response,NL_Student,Correctness Rate,Naturalness Rate,Evaluator,Comments,Board
1230,60,0,Start(),"Hi, could you please tell me how to play Quarto?",Start,"Sure, let's get started!",Shaobo,5,5,John,,0-0-0-0-0-0-0-0-0-0-0-0-0-0-0-0
1230,60,1,RequestNewWinCondition(),Could you show me a win first?,Inform,Assume you demonstrate this win condition,Shaobo,5,5,John,,0-0-7-0-0-0-13-0-0-0-15-0-0-0-11-0
1230,60,2,RequestNewWinCondition(),Could you show me another winning board?,Inform,Assume you demonstrate this win condition,Shaobo,5,5,John,,6-0-0-0-0-5-0-0-0-0-2-0-0-0-0-7
1230,60,3,"Context Switch, Confirm(User_ID=1, AddPiece(2,1))","Go back to the first board, is it still a win if I add a piece on the third row and the second column?",NotSure(),"Sorry, I am not sure about it.",Shaobo,5,3,John,,0-0-7-0-0-0-13-0-0-0-15-0-0-0-11-0
1230,60,4,"Context Switch, Confirm(User_ID=1, Quantity)","Switching to this board, does the number of pieces matter?",NotSure(),"Sorry, I am not sure about it.",Shaobo,5,4,John,,6-0-0-0-0-5-0-0-0-0-2-0-0-0-0-7
1230,60,5,"Same, Confirm(User_ID=1, RemovePiece(0,3))",And is it still a win if I remove the rightmost piece?,NotSure(),"Sorry, I am not sure about it.",Shaobo,5,4,John,,6-0-0-0-0-5-0-0-0-0-2-0-0-0-0-7
1230,60,6,"Same, Confirm(User_ID=1, Height)",And is it a win because of the height of the pieces?,Affirm(),"Yes, you got it!",Shaobo,5,5,John,,6-0-0-0-0-5-0-0-0-0-2-0-0-0-0-7
1230,60,7,"Context Switch, Confirm(User_ID=1, Quantity)","Switching to this board, does the number of pieces matter?",Affirm(),"Yes, you need at least four pieces for a win.",Shaobo,5,5,John,,0-0-7-0-0-0-13-0-0-0-15-0-0-0-11-0
1230,60,8,"Same, Confirm(User_ID=1, Hollowness)",And is it a win because of the hollowness of the pieces?,Negate(),"No, it is a win because all pieces have the same color.",Shaobo,5,5,John,,0-0-7-0-0-0-13-0-0-0-15-0-0-0-11-0
1230,60,9,"Context Switch, Confirm(User_ID=1, Quantity)","Switching to this board, does the number of pieces matter?",Affirm(),"Yes, you need at least four pieces for a win.",Shaobo,5,5,John,,6-0-0-0-0-5-0-0-0-0-2-0-0-0-0-7
1230,60,10,"Context Switch, Confirm(User_ID=1, AddPiece(3,0))","Switching to this board, is it still a win if I add a piece on the top left corner?",Affirm(),"Yes, it is still a win.",Shaobo,5,5,John,,0-0-7-0-0-0-13-0-0-0-15-0-0-0-11-0
1230,60,11,Finish(),Thanks for the help! I have learned a lot!,Finish,You are welcome!,Shaobo,5,5,John,,0-0-7-0-0-0-13-0-0-0-15-0-0-0-11-0
