dialog_id,CooperativityRate,Turn Exchange,Formal System Query,NL System Query,Formal User Response,User Response,NL_Student,Correctness Rate,Naturalness Rate,Evaluator,Comments,Board
1003,60,0,Start(),"Hi, can you give me some advice on playing Quarto?",Start,"Ok, what do you want to know?",Tianyi,5,4,Ruijie,,0-0-0-0-0-0-0-0-0-0-0-0-0-0-0-0
1003,60,1,RequestNewWinCondition(),Can you show me a winning board?,Inform,Assume you demonstrate this win condition,Tianyi,5,5,Ruijie,,3-0-0-0-5-0-0-0-8-0-0-0-6-0-0-0
1003,60,2,RequestNewWinCondition(),Can you show me another winning board?,Inform,Assume you demonstrate this win condition,Tianyi,5,5,Ruijie,,0-0-0-0-0-0-0-0-0-0-0-0-12-1-9-10
1003,60,3,"Same, Confirm(User_ID=1, RemovePiece(0,3))","For this board, if I remove the piece at the rightmost column, is it still a win?",NotSure(),"Sorry, I am uncertain about this.",Tianyi,5,4,Ruijie,,0-0-0-0-0-0-0-0-0-0-0-0-12-1-9-10
1003,60,4,RequestNewWinCondition(),Can you show me a new win pattern?,Inform,Assume you demonstrate this win condition,Tianyi,5,5,Ruijie,,1-0-0-0-5-0-0-0-11-0-0-0-15-0-0-0
1003,60,5,"Context Switch, Request(User_ID=1, Rotate)","In this case, can I rotate some pieces and still maintain the win?","Inform([45, 90])","Yes, you can rotate all pieces 45 degrees to the rows and put them in the diagonal, or you can rotate all pieces 90 degrees to the rows and put them in the first column.",Tianyi,5,4,Ruijie,,0-0-0-0-0-0-0-0-0-0-0-0-12-1-9-10
1003,60,6,RequestNewWinCondition(),Can you show me another new win pattern?,Inform,Assume you demonstrate this win condition,Tianyi,5,5,Ruijie,,0-0-0-0-0-0-0-0-0-0-0-0-7-11-8-15
1003,60,7,"Same, Confirm(User_ID=1, Quantity)","In this win, is it a win because there are four pieces on the board?",Affirm(),Yes.,Tianyi,5,4,Ruijie,,0-0-0-0-0-0-0-0-0-0-0-0-7-11-8-15
1003,60,8,"Same, Confirm(User_ID=1, Translate([3, 0]))","And, if I move all pieces three blocks up, can it still be a win?",NotSure(),I am not sure about this.,Tianyi,5,5,Ruijie,,0-0-0-0-0-0-0-0-0-0-0-0-7-11-8-15
1003,60,9,"Context Switch, Confirm(User_ID=1, Quantity)","In this board, is it a win because there are four pieces on the board?",NotSure(),"Sorry, I am not sure about this.",Tianyi,5,4,Ruijie,,0-0-0-0-0-0-0-0-0-0-0-0-12-1-9-10
1003,60,10,"Context Switch, Confirm(User_ID=1, RemovePiece(0,0))","In this win, if I remove the piece at the first row, is it still a win?",Negate(),"No, it will no longer be a win if you do that.",Tianyi,5,4,Ruijie,,1-0-0-0-5-0-0-0-11-0-0-0-15-0-0-0
1003,60,11,RequestNewWinCondition(),Can you show me a new win pattern?,Inform,Assume you demonstrate this win condition,Tianyi,5,5,Ruijie,,0-0-0-7-0-0-6-0-0-13-0-0-16-0-0-0
1003,60,12,"Context Switch, RequestOtherPlayers()","In this board, can someone do something to prevent the win?",Inform([]),"No, there is nothing he/she can do.",Tianyi,5,4,Ruijie,,0-0-0-0-0-0-0-0-0-0-0-0-12-1-9-10
1003,60,13,"Context Switch, Confirm(User_ID=1, Shape)","In this board, is it wins because of the shape of the pieces?",NotSure(),"That is a good question, I have no idea about this.",Tianyi,5,5,Ruijie,,0-0-0-7-0-0-6-0-0-13-0-0-16-0-0-0
1003,60,14,"Same, Confirm(User_ID=1, Color)",Is it wins because some pieces are green?,NotSure(),I don't know.,Tianyi,5,4,Ruijie,,0-0-0-7-0-0-6-0-0-13-0-0-16-0-0-0
1003,60,15,Finish(),Thank you for your sharing.,Finish,You are welcome.,Tianyi,5,5,Ruijie,,0-0-0-7-0-0-6-0-0-13-0-0-16-0-0-0
