dialog_id,CooperativityRate,Turn Exchange,Formal System Query,NL System Query,Formal User Response,User Response,NL_Student,Correctness Rate,Naturalness Rate,Evaluator,Comments,Board
1231,60,0,Start(),"Hi, do you have time to teach me how to play Quarto?",Start,"Sure, let's get started!",Shaobo,5,5,John,,0-0-0-0-0-0-0-0-0-0-0-0-0-0-0-0
1231,60,1,RequestNewWinCondition(),Could you show me a win first?,Inform,Assume you demonstrate this win condition,Shaobo,5,5,John,,0-15-0-0-0-3-0-0-0-7-0-0-0-13-0-0
1231,60,2,RequestNewWinCondition(),Could you show me another winning board?,Inform,Assume you demonstrate this win condition,Shaobo,5,5,John,,0-0-0-8-0-0-4-0-0-16-0-0-10-0-0-0
1231,60,3,"Context Switch, Confirm(User_ID=1, Hollowness)","Switching to this board, is it a win because of the hollowness of the pieces?",NotSure(),"Sorry, I am not sure about it.",Shaobo,5,4,John,,0-15-0-0-0-3-0-0-0-7-0-0-0-13-0-0
1231,60,4,"Context Switch, Confirm(User_ID=1, Color)","Switching to this board, is it a win because of the color of the pieces?",Affirm(),"Yes, you got it!",Shaobo,5,5,John,,0-0-0-8-0-0-4-0-0-16-0-0-10-0-0-0
1231,60,5,RequestNewWinCondition(),Could you show me one more winning board?,Inform,Assume you demonstrate this win condition,Shaobo,5,5,John,,12-0-0-0-0-2-0-0-0-0-9-0-0-0-0-1
1231,60,6,"Same, Confirm(User_ID=1, Height)",And is it a win because of the height of the pieces?,NotSure(),I don't think so but I am not sure.,Shaobo,4,5,John,,12-0-0-0-0-2-0-0-0-0-9-0-0-0-0-1
1231,60,7,"Context Switch, Confirm(User_ID=1, AddPiece(2,2))","Switching to this board, is it still a win if I remove the piece on the third row and the third column?",Affirm(),"Yes, it is still a win.",Shaobo,5,5,John,,0-15-0-0-0-3-0-0-0-7-0-0-0-13-0-0
1231,60,8,RequestNewWinCondition(),Is there any other way to win?,Inform,Assume you demonstrate this win condition,Shaobo,5,5,John,,2-0-0-0-0-8-0-0-0-0-1-0-0-0-0-3
1231,60,9,"Context Switch, RequestOtherPlayers()","Switching to this board, how could another player revoke this win?",Inform([]),There is nothing that another player could do to prevent this win.,Shaobo,5,5,John,,0-0-0-8-0-0-4-0-0-16-0-0-10-0-0-0
1231,60,10,Finish(),Thanks for the help! I have learned a lot!,Finish,You are welcome!,Shaobo,5,5,John,,0-0-0-8-0-0-4-0-0-16-0-0-10-0-0-0
