dialog_id,CooperativityRate,Turn Exchange,Formal System Query,NL System Query,Formal User Response,User Response,NL_Student,Correctness Rate,Naturalness Rate,Evaluator,Comments,Board
41,100,0,Start(),Hi! Could you teach me how to play Quarto?,Start,"Yeah, sure!",Luke,5,5,John,,0-0-0-0-0-0-0-0-0-0-0-0-0-0-0-0
41,100,1,RequestNewWinCondition(),Could you show me a win condition?,Inform(),Assume you demonstrate this win condition,Luke,5,5,John,,7-0-0-0-0-5-0-0-0-0-3-0-0-0-0-11
41,100,2,RequestNewWinCondition(),Can I see a new win condition?,Inform(),Assume you demonstrate this win condition,Luke,5,5,John,,0-0-0-0-0-0-0-0-0-0-0-0-15-12-8-16
41,100,3,"Context Switch, Confirm(User_ID=1, Height)","Referring back to the first board, is this a win because of the height of the shapes?",Negate(),"No, this is not the case.",Luke,5,5,John,,7-0-0-0-0-5-0-0-0-0-3-0-0-0-0-11
41,100,4,RequestNewWinCondition(),Can you show me another win condition?,Inform(),Assume you demonstrate this win condition,Luke,5,5,John,,4-0-0-0-8-0-0-0-6-0-0-0-7-0-0-0
41,100,5,"Context Switch, Confirm(User_ID=1, Translate('row1'))",Am I allowed to translate the pieces on the board and still win?,Affirm,"Yes, as a matter of fact, you can.",Luke,0,4,John,Not a correct interpretation,0-0-0-0-0-0-0-0-0-0-0-0-15-12-8-16
41,100,6,"Context Switch, Confirm(User_ID=1, Quantity)","Going back to the previous board, is this win dependent on the number of pieces on the board?",Affirm(),"Yes, it is. For example, if there were less than four pieces along the first column, there wouldn't be a win.",Luke,4,4,John,,4-0-0-0-8-0-0-0-6-0-0-0-7-0-0-0
41,100,7,"Context Switch, Confirm(User_ID=1, RemovePiece(1,2))","Going back to the board where the pieces are along the diagonal, can I remove this piece here?",Negate(),No. This would not be sufficient for a win condition.,Luke,5,5,John,,7-0-0-0-0-5-0-0-0-0-3-0-0-0-0-11
41,100,8,RequestNewWinCondition(),Let me see another win condition.,Inform(),Assume you demonstrate this win condition,Luke,5,5,John,,8-0-0-0-5-0-0-0-6-0-0-0-15-0-0-0
41,100,9,"Context Switch, Confirm(User_ID=1, Consistency)","For this board right here, is this a win because of the hollowness of the pieces?",Affirm(),Yes you are correct.,Luke,4,5,John,"""consistincy"" is not a synonym for ""hollowness""",0-0-0-0-0-0-0-0-0-0-0-0-15-12-8-16
41,100,10,"Same , Confirm(User_ID=1, AddPiece(2,2))","Let's say I add a piece to that empty space right there, would this still be a win.",Affirm(),"As a matter of fact, it would still be a win.",Luke,5,5,John,,0-0-0-0-0-0-0-0-0-0-0-0-15-12-8-16
41,100,11,"Context Switch, Confirm(User_ID=1, Shape)","If I were to replace the pieces with other-shaped pieces, will this still be a win?",Negate(),"Yes, the shape can be changed without any violations of a win condition.",Luke,2,2,John,,4-0-0-0-8-0-0-0-6-0-0-0-7-0-0-0
41,100,12,"Same, Request(User_ID=1, Rotate)",Are there any rotations that I can make to the board such that I still have a win condition?,"Inform([0, 45])",You can rotate the pieces by 45 degrees.,Luke,0,3,John,,4-0-0-0-8-0-0-0-6-0-0-0-7-0-0-0
41,100,13,"Context Switch, Request(User_ID=1, Translate)",How can I translate this row of pieces while still maintaining a winning board?,"Inform(['row1', 'row2', 'row3'])","You can shift the filled row up one, two, or three spots.",Luke,5,5,John,,0-0-0-0-0-0-0-0-0-0-0-0-15-12-8-16
41,100,14,"Context Switch, Request(User_ID=1, Rotate)","For this board, can I rotate the column of pieces and still win?","Inform([0, 45])",We already went through this possibility! You can rotate the column by 45 degrees.,Luke,1,3,John,,4-0-0-0-8-0-0-0-6-0-0-0-7-0-0-0
41,100,15,Finish(),I think I'm done playing Quarto for today.,Finish,Good luck on your future Quarto endeavors!,Luke,5,5,John,,4-0-0-0-8-0-0-0-6-0-0-0-7-0-0-0
