dialog_id,CooperativityRate,Turn Exchange,Formal System Query,NL System Query,Formal User Response,User Response,NL_Student,Correctness Rate,Naturalness Rate,Evaluator,Comments,Board
12,100,0,Start(),Can you show me how to win at Quarto?,Start,"Yeah, let's get started.",Dave,5,5,Daniel,,0-0-0-0-0-0-0-0-0-0-0-0-0-0-0-0
12,100,1,RequestNewWinCondition(),Give me an example of a winning board.,Inform(),Assume you demonstrate this win condition,Dave,5,5,Daniel,,0-14-0-0-0-10-0-0-0-6-0-0-0-16-0-0
12,100,2,"Same, Confirm(User_ID=1, Height)",So is this a win because of the height of the pieces?,Negate(),"Nope, the height of the pieces is irrelevant here.",Dave,5,5,Daniel,,0-14-0-0-0-10-0-0-0-6-0-0-0-16-0-0
12,100,3,RequestNewWinCondition(),Give me another example.,Inform(),Assume you demonstrate this win condition,Dave,5,5,Daniel,,0-0-0-10-0-0-16-0-0-13-0-0-11-0-0-0
12,100,4,"Context Switch, RequestOtherPlayers()","Before I get to that, I was just thinking: can you sabotage my win somehow?",Inform([]),"Lol, unfortunately not.",Dave,5,5,Daniel,,0-14-0-0-0-10-0-0-0-6-0-0-0-16-0-0
12,100,5,"Same, Confirm(User_ID=1, Height)",So you're sure it didn't count because of the height?,Negate(),"Yeah, the height is not the reason why this counts. Keep thinking.",Dave,5,5,Daniel,,0-14-0-0-0-10-0-0-0-6-0-0-0-16-0-0
12,100,6,RequestNewWinCondition(),How about a different example.,Inform(),Assume you demonstrate this win condition,Dave,5,5,Daniel,,0-0-0-4-0-0-16-0-0-6-0-0-12-0-0-0
12,100,7,"Context Switch, Confirm(User_ID=1, RemovePiece(3,3))","Sorry to do this to you again. Going back to the second example you showed me now, what happens if I take away the blue triangle?",Negate(),Now you no longer have a win.,Dave,5,5,Daniel,,0-0-0-10-0-0-16-0-0-13-0-0-11-0-0-0
12,100,8,RequestNewWinCondition(),"Okay, let's try another example.",Inform(),Assume you demonstrate this win condition,Dave,5,5,Daniel,,0-0-0-0-0-0-0-0-0-0-0-0-2-6-13-9
12,100,9,RequestNewWinCondition(),Give me a different one.,Inform(),Assume you demonstrate this win condition,Dave,5,5,Daniel,,0-0-0-0-0-0-0-0-0-0-0-0-2-5-1-3
12,100,10,Finish(),I'm done for now. Thanks for helping me out.,Finish,It was my pleasure. Take care.,Dave,5,5,Daniel,,0-0-0-0-0-0-0-0-0-0-0-0-2-5-1-3
