dialog_id,CooperativityRate,Turn Exchange,Formal System Query,NL System Query,Formal User Response,User Response,NL_Student,Correctness Rate,Naturalness Rate,Evaluator,Comments,Board
255,100,0,Start(),"Hi, I am learning how to play Quarto, can you tell me about it?",Start,"Sure, which part you want to start?",Tianyi,5,4,Jacob,The system query should be two sentences.,0-0-0-0-0-0-0-0-0-0-0-0-0-0-0-0
255,100,1,RequestNewWinCondition(),Can show me a example of win?,Inform(),Assume you demonstrate this win condition,Tianyi,5,3,Jacob,"Replace ""a"" with ""an"" and add ""a"" before ""win.""",15-0-0-0-8-0-0-0-6-0-0-0-14-0-0-0
255,100,2,RequestNewWinCondition(),Can you show me other win patterns?,Inform(),Assume you demonstrate this win condition,Tianyi,4,4,Jacob,"This formal query asks for a singular win condition, not multiple.",11-0-0-0-5-0-0-0-15-0-0-0-7-0-0-0
255,100,3,"Same, Confirm(User_ID=1, Rotate(45))","In this case, if I rotate all pieces by 45 degrees and put them in the diagonal from bottom left to up right, is it still a win?",Affirm(),"Yes, that is still a win condition.",Tianyi,3,5,Jacob,"The pieces themselves don't actually have to be rotated, only the orientation of the pattern.",11-0-0-0-5-0-0-0-15-0-0-0-7-0-0-0
255,100,4,RequestNewWinCondition(),Can show me a new win pattern?,Inform(),Assume you demonstrate this win condition,Tianyi,5,5,Jacob,,0-0-0-0-0-0-0-0-0-0-0-0-9-10-6-13
255,100,5,"Same, Request(User_ID=1, Translate)","So, can I move some pieces in the board and still maintain the win?","Inform(['row1', 'row2', 'row3'])","Yeah, you can move all pieces to either second row, third row, or fourth row. Just make sure they are all in the same row.",Tianyi,3,4,Jacob,"Add ""the"" before ""second."" Also, the system query should make reference to the fact that the pieces need to remain in the same row.",0-0-0-0-0-0-0-0-0-0-0-0-9-10-6-13
255,100,6,"Context Switch, Request(User_ID=1, Rotate)","In this case, can I rotate all pieces and still maintain the win condition?","Inform([0, 45])","You can rotate all pieces by 90 degrees and put them in the first row, or you can rotate all pieces by 45 degrees and put them in the diagonal from bottom left to up right.",Tianyi,4,4,Jacob,"The pieces themselves do not need to be rotated. Also replace ""up right"" with ""top right"" or ""upper right.""",11-0-0-0-5-0-0-0-15-0-0-0-7-0-0-0
255,100,7,"Same, RequestOtherPlayers()","And, can another play take actions to prevent the win?",Inform([]),"No, there is not action he can take since it is already a win.",Tianyi,5,5,Jacob,,11-0-0-0-5-0-0-0-15-0-0-0-7-0-0-0
255,100,8,"Same, Confirm(User_ID=1, Rotate(45))","If I rotate all pieces by 45 degrees and put them in the diagonal from bottom left to up right, is that still a win?",Affirm(),"Yes, that board will still in a win pattern.",Tianyi,4,4,Jacob,"The pieces themselves aren't rotated, just the pattern on the board. Also, ""up right"" seems somewhat unidiomatic.",11-0-0-0-5-0-0-0-15-0-0-0-7-0-0-0
255,100,9,"Same, Request(User_ID=1, Translate)",Can I move some pieces and maintain the win?,"Inform(['col1', 'col2', 'col3'])","You can do something like move all pieces to either second column, third column, or fourth column.",Tianyi,3,4,Jacob,"The system query should make clear that the pieces need to remain in the same formation. Additionally, add ""the"" before ""second.""",11-0-0-0-5-0-0-0-15-0-0-0-7-0-0-0
255,100,10,Finish(),"Thanks, that game is interesting.",Finish,You are welcome.,Tianyi,5,4,Jacob,"Since Quarto is the topic of the conversation, ""this game"" would make more sense than ""that game.""",11-0-0-0-5-0-0-0-15-0-0-0-7-0-0-0
