dialog_id,CooperativityRate,Turn Exchange,Formal System Query,NL System Query,Formal User Response,User Response,NL_Student,Correctness Rate,Naturalness Rate,Evaluator,Comments,Board
630,60,0,Start(),"Hello, can you teach me how to play Quarto?",Start,"Sure, let's begin.",Yiyan,5,5,Tianyi,,0-0-0-0-0-0-0-0-0-0-0-0-0-0-0-0
630,60,1,RequestNewWinCondition(),Can you first show me a win condition?,Inform,Assume you demonstrate this win condition,Yiyan,5,5,Tianyi,,8-0-0-0-0-7-0-0-0-0-4-0-0-0-0-15
630,60,2,"Same, Confirm(User_ID=1, Height)","For this win condition you showed, is it a win because of the heights of the pieces?",NotSure(),"I am not quite sure, sorry.",Yiyan,5,5,Tianyi,,8-0-0-0-0-7-0-0-0-0-4-0-0-0-0-15
630,60,3,"Same, Confirm(User_ID=1, Rotate(90))","For the same board, can I maintain the win by rotating the pieces to the last column.",Affirm(),"Sure, you can do that.",Yiyan,5,5,Tianyi,,8-0-0-0-0-7-0-0-0-0-4-0-0-0-0-15
630,60,4,"Same, Request(User_ID=1, Rotate)","For the same board, how can I rotate the pieces to get a new win?",Inform([90]),"You can rotate it the last column, just as you said before.",Yiyan,5,5,Tianyi,,8-0-0-0-0-7-0-0-0-0-4-0-0-0-0-15
630,60,5,RequestNewWinCondition(),Could you show me one more win condition please?,Inform,Assume you demonstrate this win condition,Yiyan,5,5,Tianyi,,15-0-0-0-0-16-0-0-0-0-9-0-0-0-0-12
630,60,6,"Same, Confirm(User_ID=1, Color)","For that condition you just showed, is it a win because of the color of the pieces?",Negate(),"No, it is a win because of the all the pieces have the same heights.",Yiyan,5,5,Tianyi,,15-0-0-0-0-16-0-0-0-0-9-0-0-0-0-12
630,60,7,"Context Switch, Confirm(User_ID=1, Hollowness)","Let's consider this board, is it a win because all the pieces have hollow?",Affirm(),"Yes, you can win by having all the pieces with with hollows.",Yiyan,5,5,Tianyi,,8-0-0-0-0-7-0-0-0-0-4-0-0-0-0-15
630,60,8,"Same, Confirm(User_ID=1, Quantity)","For the same board, is it a win because of the number of the pieces?",Affirm(),"Yes, you must have at least four pieces in order to win.",Yiyan,5,5,Tianyi,,8-0-0-0-0-7-0-0-0-0-4-0-0-0-0-15
630,60,9,"Same, Confirm(User_ID=1, AddPiece(1,0))","For the same board, would it still be a win if I add a pieces on the first position of the second row?",NotSure(),"I don't know, sorry.",Yiyan,5,5,Tianyi,,8-0-0-0-0-7-0-0-0-0-4-0-0-0-0-15
630,60,10,RequestNewWinCondition(),Could you show me one more win case?,Inform,Assume you demonstrate this win condition,Yiyan,5,5,Tianyi,,6-0-0-0-0-10-0-0-0-0-9-0-0-0-0-1
630,60,11,"Context Switch, Confirm(User_ID=1, RemovePiece(0,3))","Let's turn to this board, would it still be a win if I remove the piece on the bottom right corner?",NotSure(),I am not quite sure.,Yiyan,5,5,Tianyi,,8-0-0-0-0-7-0-0-0-0-4-0-0-0-0-15
630,60,12,Finish(),"Well, I think I have known enough about Quarto, thanks.",Finish,You are welcome.,Yiyan,5,5,Tianyi,,8-0-0-0-0-7-0-0-0-0-4-0-0-0-0-15
