dialog_id,CooperativityRate,Turn Exchange,Formal System Query,NL System Query,Formal User Response,User Response,NL_Student,Correctness Rate,Naturalness Rate,Evaluator,Comments,Board
1220,60,0,Start(),"Hi, could you teach me how to play Quarto?",Start,"Sure, let's get started!",Shaobo,5,5,John,,0-0-0-0-0-0-0-0-0-0-0-0-0-0-0-0
1220,60,1,RequestNewWinCondition(),Could you show me a win first?,Inform,Assume you demonstrate this win condition,Shaobo,5,5,John,,0-0-0-0-0-0-0-0-0-0-0-0-1-15-5-7
1220,60,2,RequestNewWinCondition(),Is there any other way to win?,Inform,Assume you demonstrate this win condition,Shaobo,5,5,John,,0-0-0-0-0-0-0-0-0-0-0-0-2-9-14-6
1220,60,3,RequestNewWinCondition(),Could you show me another winning board?,Inform,Assume you demonstrate this win condition,Shaobo,5,5,John,,0-0-0-4-0-0-3-0-0-11-0-0-9-0-0-0
1220,60,4,"Context Switch, Confirm(User_ID=1, RemovePiece(0,1))","Switching to this board, is it still a win if I remove the piece on the second column?",Negate(),"No, you need at least four pieces for a win.",Shaobo,5,4,John,,0-0-0-0-0-0-0-0-0-0-0-0-1-15-5-7
1220,60,5,RequestNewWinCondition(),Could you show me another winning board?,Inform,Assume you demonstrate this win condition,Shaobo,5,5,John,,0-0-0-0-0-0-0-0-0-0-0-0-9-12-13-16
1220,60,6,"Context Switch, Confirm(User_ID=1, Hollowness)","Switching to this board, is it a win because of the hollowness of the pieces?",Negate(),"No, it is a win because all pieces have the same shape.",Shaobo,5,5,John,,0-0-0-4-0-0-3-0-0-11-0-0-9-0-0-0
1220,60,7,RequestNewWinCondition(),Could you show me one more winning board?,Inform,Assume you demonstrate this win condition,Shaobo,5,5,John,,10-0-0-0-0-12-0-0-0-0-14-0-0-0-0-11
1220,60,8,"Context Switch, Request(User_ID=1, Translate)","Switching to this board, how could I shift the pieces and still keep the win?","Inform(['row2', 'row3'])",You could shift them to the top or the second top row.,Shaobo,5,5,John,,0-0-0-0-0-0-0-0-0-0-0-0-2-9-14-6
1220,60,9,Finish(),Thanks for the help! I have learned a lot!,Finish,You are welcome!,Shaobo,5,5,John,,0-0-0-0-0-0-0-0-0-0-0-0-2-9-14-6
