dialog_id,CooperativityRate,Turn Exchange,Formal System Query,NL System Query,Formal User Response,User Response,NL_Student,Correctness Rate,Naturalness Rate,Evaluator,Comments,Board
79,100,0,Start(),"Hey, how's it going? Ready to teach me some Quarto?",Start,"Oh boy, I sure am! Let's get started!",Dave,5,5,Dmytro,,0-0-0-0-0-0-0-0-0-0-0-0-0-0-0-0
79,100,1,RequestNewWinCondition(),Give me an example of a win!,Inform(),Assume you demonstrate this win condition,Dave,5,5,Dmytro,,0-0-0-0-0-0-0-0-0-0-0-0-15-5-3-7
79,100,2,"Same , Confirm(User_ID=1, Color)",Does this count because all four pieces are all green?,Affirm(),Precisely!,Dave,5,5,Dmytro,,0-0-0-0-0-0-0-0-0-0-0-0-15-5-3-7
79,100,3,"Same, Request(User_ID=1, Rotate)",Can I rotate the pieces about the bottom-right corner for a win?,"Inform([45, 90])","You can do so along the diagonal, from the bottom-left to the top-right, as well as straight up the first column!",Dave,2,4,Dmytro,"while natural, it's incorrect",0-0-0-0-0-0-0-0-0-0-0-0-15-5-3-7
79,100,4,RequestNewWinCondition(),"Show me another, por favor.",Inform(),Assume you demonstrate this win condition,Dave,5,5,Dmytro,,0-0-0-0-0-0-0-0-0-0-0-0-6-1-2-10
79,100,5,"Same, Confirm(User_ID=1, Rotate(45))",Can I place this sequence of pieces along the diagonal and still have a win?,Affirm(),"Yeah, that's right.",Dave,5,5,Dmytro,,0-0-0-0-0-0-0-0-0-0-0-0-6-1-2-10
79,100,6,RequestNewWinCondition(),How about another example sir.,Inform(),Assume you demonstrate this win condition,Dave,5,5,Dmytro,,0-0-13-0-0-0-1-0-0-0-15-0-0-0-7-0
79,100,7,"Context Switch, Confirm(User_ID=1, Quantity)",Does the first example you showed me count because there are four and only four pieces?,Affirm(),That's it!,Dave,5,4,Dmytro,specify it's the 'board example',0-0-0-0-0-0-0-0-0-0-0-0-15-5-3-7
79,100,8,"Same, Confirm(User_ID=1, Height)",And does that example count because of the varying heights of the pieces?,Negate(),"No, not quite.",Dave,3,4,Dmytro,I couldn't find reference for how height is depicted in the figures. ,0-0-0-0-0-0-0-0-0-0-0-0-15-5-3-7
79,100,9,"Same, Request(User_ID=1, Translate)",Where can I shift this placement of pieces and still secure a win?,"Inform(['row1', 'row2', 'row3'])","In addition to placing thsis sequence of pieces along the bottom row, you can place them along any of the three remaining empty rows and still secure a win.",Dave,5,5,Dmytro,,0-0-0-0-0-0-0-0-0-0-0-0-15-5-3-7
79,100,10,RequestNewWinCondition(),I'm ready for another example.,Inform(),Assume you demonstrate this win condition,Dave,2,2,Dmytro,Another example of what ?,6-0-0-0-0-5-0-0-0-0-15-0-0-0-0-7
79,100,11,"Context Switch, Confirm(User_ID=1, Color)",Let's step back to the third example for a moment. Does this count because all four pieces are green?,Affirm(),"Yes, that's right!",Dave,5,5,Dmytro,,0-0-13-0-0-0-1-0-0-0-15-0-0-0-7-0
79,100,12,"Win Context Switch {'ActionName': 'Confirm_Hollowness', 'FirstPart': None, 'ID': 1, 'SecondPart': None}",And does the first example count because of the hollowness of the pieces?,Negate(),"No, that isn't right.",Dave,5,5,Dmytro,,0-0-0-0-0-0-0-0-0-0-0-0-15-5-3-7
79,100,13,"Context Switch, Confirm(User_ID=1, Height)",Does the second example you showed me count because of the heights of the pieces?,Negate(),"No, height has nothing to with it in this case.",Dave,4,4,Dmytro,are they tall or short ?,0-0-0-0-0-0-0-0-0-0-0-0-6-1-2-10
79,100,14,"Context Switch, Confirm(User_ID=1, Rotate(90))","With regard to the first example, would it still count even if the pieces were placed down the first column instead of placing them along the bottom row?",Affirm(),Sure it would.,Dave,5,5,Dmytro,,0-0-0-0-0-0-0-0-0-0-0-0-15-5-3-7
79,100,15,Finish(),"Well, I'm spent. Thanks for your help.",Finish,I'm looking forward to teaching you more about Quarto soon.,Dave,5,5,Dmytro,,0-0-0-0-0-0-0-0-0-0-0-0-15-5-3-7
