dialog_id,CooperativityRate,Turn Exchange,Formal System Query,NL System Query,Formal User Response,User Response,NL_Student,Correctness Rate,Naturalness Rate,Evaluator,Comments,Board
396,50,0,Start(),Hello!  Can you teach me to play Quarto please?,Start,"Sure, I'd be glad to.",Daniel,,,,,0-0-0-0-0-0-0-0-0-0-0-0-0-0-0-0
396,50,1,RequestNewWinCondition(),Can you show me a board where someone wins please?,Inform,Assume you demonstrate this win condition,Daniel,,,,,0-0-0-0-0-0-0-0-0-0-0-0-14-15-12-10
396,50,2,"Same, RequestOtherPlayers()",For this board what can the other player do to stop this win?,Inform([]),Nothing,Daniel,,,,,0-0-0-0-0-0-0-0-0-0-0-0-14-15-12-10
396,50,3,RequestNewWinCondition(),Can you show me a different way to win please?,Inform,Assume you demonstrate this win condition,Daniel,,,,,0-0-0-16-0-0-7-0-0-6-0-0-5-0-0-0
396,50,4,"Same, RequestOtherPlayers()",Now for this new board can the other player do anything to prevent a win?,Inform([]),No,Daniel,,,,,0-0-0-16-0-0-7-0-0-6-0-0-5-0-0-0
396,50,5,RequestNewWinCondition(),Are there any other ways to win?,Inform,Assume you demonstrate this win condition,Daniel,,,,,0-0-0-14-0-0-2-0-0-8-0-0-4-0-0-0
396,50,6,"Same, Confirm(User_ID=1, Quantity)",Is this board a win because of the number of pieces?,NotSure(),I don't know,Daniel,,,,,0-0-0-14-0-0-2-0-0-8-0-0-4-0-0-0
396,50,7,"Context Switch, Request(User_ID=1, Translate)",Can I slide these pieces anywhere and still win?,"Inform(['row1', 'row2'])",Yes you can move them up one or two rows.,Daniel,,,,,0-0-0-0-0-0-0-0-0-0-0-0-14-15-12-10
396,50,8,RequestNewWinCondition(),Can you show me a different winning board please?,Inform,Assume you demonstrate this win condition,Daniel,,,,,0-0-0-0-0-0-0-0-0-0-0-0-7-13-15-8
396,50,9,"Context Switch, Confirm(User_ID=1, Shape)",For this other board is it a win because of the shape of the pieces?,NotSure(),I don't know,Daniel,,,,,0-0-0-0-0-0-0-0-0-0-0-0-14-15-12-10
396,50,10,"Context Switch, Confirm(User_ID=1, Rotate(90))",If I rotate these pieces 90 degrees is it still a win?,Affirm(),Yes,Daniel,,,,,0-0-0-0-0-0-0-0-0-0-0-0-7-13-15-8
396,50,11,"Context Switch, Confirm(User_ID=1, Height)","For this other board, is it a win because of the height of the pieces?",NotSure(),I don't know.,Daniel,,,,,0-0-0-0-0-0-0-0-0-0-0-0-14-15-12-10
396,50,12,"Context Switch, Confirm(User_ID=1, Height)","For this other board, is it a win because of the height of the pieces?",Negate(),No,Daniel,,,,,0-0-0-14-0-0-2-0-0-8-0-0-4-0-0-0
396,50,13,"Context Switch, Confirm(User_ID=1, Height)","For this third board, is it a win because of the height of the pieces?",Negate(),No,Daniel,,,,,0-0-0-0-0-0-0-0-0-0-0-0-7-13-15-8
396,50,14,"Context Switch, Confirm(User_ID=1, Color)","In this other scenario, is it a win because of the color of the pieces?",Negate(),No,Daniel,,,,,0-0-0-0-0-0-0-0-0-0-0-0-14-15-12-10
396,50,15,Finish(),Thank you for teaching me,Finish,No problem,Daniel,,,,,0-0-0-0-0-0-0-0-0-0-0-0-14-15-12-10
