dialog_id,CooperativityRate,Turn Exchange,Formal System Query,NL System Query,Formal User Response,User Response,NL_Student,Correctness Rate,Naturalness Rate,Evaluator,Comments,Board
567,60,0,Start(),"Hi, can you help me learn Quarto?	",Start,"Sure, shall we start now?",Yiyan,5,5,Tianyi,,0-0-0-0-0-0-0-0-0-0-0-0-0-0-0-0
567,60,1,RequestNewWinCondition(),"Thank you. Firstly, could you show me a win condition?",Inform,Assume you demonstrate this win condition,Yiyan,5,5,Tianyi,,0-6-0-0-0-7-0-0-0-16-0-0-0-13-0-0
567,60,2,"Same, RequestOtherPlayers()","For the win board you just demostrated,  how can the other player do to stop this win?	",Inform([]),There is nothing the other player can do.,Yiyan,5,5,Tianyi,,0-6-0-0-0-7-0-0-0-16-0-0-0-13-0-0
567,60,3,"Same, Confirm(User_ID=1, Translate([0, 0]))","For the same board,  can I shift the pieces to the first column while maintaining the win?",Affirm(),"Yes, you can.",Yiyan,5,5,Tianyi,,0-6-0-0-0-7-0-0-0-16-0-0-0-13-0-0
567,60,4,RequestNewWinCondition(),Could you please show me one more win case?,Inform,Assume you demonstrate this win condition,Yiyan,5,5,Tianyi,,16-0-0-0-0-11-0-0-0-0-13-0-0-0-0-9
567,60,5,RequestNewWinCondition(),Is there any other way to win the game?,Inform,Assume you demonstrate this win condition,Yiyan,5,4,Tianyi,,0-0-0-7-0-0-0-13-0-0-0-1-0-0-0-3
567,60,6,"Context Switch, Confirm(User_ID=1, Shape)","Let's take a look at this win case, do the shapes of the pieces relate to this win?",Negate(),"No, the actual reason is that all the pieces are equally high.",Yiyan,5,5,Tianyi,,16-0-0-0-0-11-0-0-0-0-13-0-0-0-0-9
567,60,7,"Context Switch, Confirm(User_ID=1, Shape)","Let's switch to this board, do the shapes of the pieces matter?",Negate(),"No, the shapes do not matter in this example.",Yiyan,5,5,Tianyi,,0-0-0-7-0-0-0-13-0-0-0-1-0-0-0-3
567,60,8,"Same, RequestOtherPlayers()","For the same board, is there any method that the other player can use to stop this win?",Inform([]),"There is nothing the other player can do, since one player has won the game. ",Yiyan,5,5,Tianyi,,0-0-0-7-0-0-0-13-0-0-0-1-0-0-0-3
567,60,9,"Same, Confirm(User_ID=1, AddPiece(0,2))","Still for this board, can I get another win by adding a piece on the third position of the first row?",NotSure(),"I guess so, but I am not sure.",Yiyan,5,5,Tianyi,,0-0-0-7-0-0-0-13-0-0-0-1-0-0-0-3
567,60,10,"Context Switch, Confirm(User_ID=1, Translate([0, 0]))","Let's turn to this win case,  can I shift the pieces to the first column while maintaining the win?",Affirm(),"Yes, you can.",Yiyan,5,5,Tianyi,,0-6-0-0-0-7-0-0-0-16-0-0-0-13-0-0
567,60,11,"Context Switch, Request(User_ID=1, Translate)","Let's turn to this win case, how can I shift the pieces while maintaining this win?","Inform(['col1', 'col2'])",You can shift them to the second or the third column.,Yiyan,5,4,Tianyi,,0-0-0-7-0-0-0-13-0-0-0-1-0-0-0-3
567,60,12,"Same, Confirm(User_ID=1, Height)","Let's consider this board, is this a win because of the heights of the pieces?",Negate(),"No, it is a win because all the pieces have the same color.",Yiyan,5,5,Tianyi,,0-0-0-7-0-0-0-13-0-0-0-1-0-0-0-3
567,60,13,"Same, Confirm(User_ID=1, Quantity)","Still for this board, is it a win because of the number of the pieces?",NotSure(),"I guess so, but I am not sure.",Yiyan,5,5,Tianyi,,0-0-0-7-0-0-0-13-0-0-0-1-0-0-0-3
567,60,14,RequestNewWinCondition(),Can you show me another way to win the game?,Inform,Assume you demonstrate this win condition,Yiyan,5,5,Tianyi,,0-0-0-2-0-0-11-0-0-4-0-0-9-0-0-0
567,60,15,Finish(),"I think I know enough about Quarto, thank you very much.",Finish,You are welcome.,Yiyan,5,4,Tianyi,,0-0-0-2-0-0-11-0-0-4-0-0-9-0-0-0
