dialog_id,CooperativityRate,Turn Exchange,Formal System Query,NL System Query,Formal User Response,User Response,NL_Student,Correctness Rate,Naturalness Rate,Evaluator,Comments,Board
259,100,0,Start(),"Hi, can you teach me how to play Quarto?",Start,Sure.,Yiyan,5,5,Jason,,0-0-0-0-0-0-0-0-0-0-0-0-0-0-0-0
259,100,1,RequestNewWinCondition(),Can you show me a winning condition?,Inform(),Assume you demonstrate this win condition,Yiyan,5,4,Jason,,0-0-0-0-0-0-0-0-0-0-0-0-16-10-9-11
259,100,2,RequestNewWinCondition(),Could you show me another way to win?,Inform(),Assume you demonstrate this win condition,Yiyan,5,5,Jason,,10-0-0-0-0-12-0-0-0-0-8-0-0-0-0-4
259,100,3,"Context Switch, Confirm(User_ID=1, AddPiece(2,3))","For this new winning condition, is it still a win if I add a piece on the third row and the last column?",Affirm(),"Yes, it is still a win.",Yiyan,5,5,Jason,,0-0-0-0-0-0-0-0-0-0-0-0-16-10-9-11
259,100,4,"Same, RequestOtherPlayers()","For the same board, how can the other player do to prevent this win?",Inform([]),"No, there is nothing he or she can do.",Yiyan,5,4,Jason,"Should be ""what can the other player do""",0-0-0-0-0-0-0-0-0-0-0-0-16-10-9-11
259,100,5,RequestNewWinCondition(),Could you show me another winning condition?,Inform(),Assume you demonstrate this win condition,Yiyan,5,5,Jason,,0-0-0-0-0-0-0-0-0-0-0-0-15-7-16-11
259,100,6,"Context Switch, Request(User_ID=1, Translate)","For this new board, where can I move all the pieces to get another win?","Inform(['row1', 'row2', 'row3'])","Actually, you can move the pieces to any other rows.",Yiyan,5,3,Jason,Not natural response,0-0-0-0-0-0-0-0-0-0-0-0-16-10-9-11
259,100,7,RequestNewWinCondition(),Can you show me another way to win?,Inform(),Assume you demonstrate this win condition,Yiyan,5,5,Jason,,0-0-10-0-0-0-16-0-0-0-2-0-0-0-4-0
259,100,8,"Same, Confirm(User_ID=1, Height)","For this board you just showed, is it a win because of the heights of the pieces?",Negate(),"No, it is a win because all the pieces have the same color.",Yiyan,5,5,Jason,,0-0-10-0-0-0-16-0-0-0-2-0-0-0-4-0
259,100,9,"Same, Confirm(User_ID=1, Height)","For the same board, is it a win because the pieces have the same height?",Negate(),"No, I just told you that it is a win because the pieces have the same color.",Yiyan,5,5,Jason,,0-0-10-0-0-0-16-0-0-0-2-0-0-0-4-0
259,100,10,"Same , Confirm(User_ID=1, RemovePiece(2,2))","For the same winning board, is it still a win if I remove the piece on the third row?",Negate(),"No, in that case it is not win.",Yiyan,5,5,Jason,,0-0-10-0-0-0-16-0-0-0-2-0-0-0-4-0
259,100,11,"Context Switch, Request(User_ID=1, Rotate)","Let's change to this new board, how can I rotate the pieces to get another winning condition?",Inform([90]),You can arrange the pieces vertically.,Yiyan,3,5,Jason,Not specifiying where it would be vertically.,10-0-0-0-0-12-0-0-0-0-8-0-0-0-0-4
259,100,12,"Same , Confirm(User_ID=1, Color)","For the same senario, it is a win because the pieces have the same color?",Affirm(),"Yes, it is.",Yiyan,5,5,Jason,,10-0-0-0-0-12-0-0-0-0-8-0-0-0-0-4
259,100,13,"Same , Confirm(User_ID=1, RemovePiece(2,1))","For the same board, if I remove the piece on the third row, will it be another winning condition?",Negate(),"No, it won't since the rest of the pieces can not form any row with four pieces.",Yiyan,5,5,Jason,,10-0-0-0-0-12-0-0-0-0-8-0-0-0-0-4
259,100,14,RequestNewWinCondition(),Can you show me another way to win?,Inform(),Assume you demonstrate this win condition,Yiyan,5,5,Jason,,0-0-0-0-0-0-0-0-0-0-0-0-9-3-10-12
259,100,15,Finish(),Thanks for the help! Now I can play Quarto!,Finish,You are welcome.,Yiyan,5,5,Jason,,0-0-0-0-0-0-0-0-0-0-0-0-9-3-10-12
