dialog_id,CooperativityRate,Turn Exchange,Formal System Query,NL System Query,Formal User Response,User Response,NL_Student,Correctness Rate,Naturalness Rate,Evaluator,Comments,Board
1038,60,0,Start(),"Hi, can you tell me how to play Quarto?",Start,"Sure, what do you want to know?",Tianyi,5,5,Ruijie,,0-0-0-0-0-0-0-0-0-0-0-0-0-0-0-0
1038,60,1,RequestNewWinCondition(),Can you show me a winning board?,Inform,Assume you demonstrate this win condition,Tianyi,5,5,Ruijie,,0-0-0-7-0-0-0-13-0-0-0-11-0-0-0-5
1038,60,2,"Same, Confirm(User_ID=1, AddPiece(0,0))","In this case, if I put a new piece at the left corner, can it still be a win?",Affirm(),"Yes, you can put the new piece anywhere.",Tianyi,5,4,Ruijie,,0-0-0-7-0-0-0-13-0-0-0-11-0-0-0-5
1038,60,3,"Same, Confirm(User_ID=1, Quantity)","And, is it a win because there are four pieces on the board?",NotSure(),I cannot determine whether that is true.,Tianyi,5,4,Ruijie,,0-0-0-7-0-0-0-13-0-0-0-11-0-0-0-5
1038,60,4,"Same, Confirm(User_ID=1, Rotate(180))","If I rotate all pieces 180 degrees from the rows and put them in the top row, can it still be a winning board?",Affirm(),"Yes, it will still be a winning board.",Tianyi,5,5,Ruijie,,0-0-0-7-0-0-0-13-0-0-0-11-0-0-0-5
1038,60,5,"Same, Confirm(User_ID=1, RemovePiece(1,3))","If I remove the piece at the second row, is it still a win?",NotSure(),I have no idea about this.,Tianyi,5,5,Ruijie,,0-0-0-7-0-0-0-13-0-0-0-11-0-0-0-5
1038,60,6,RequestNewWinCondition(),Can you give me a new win?,Inform,Assume you demonstrate this win condition,Tianyi,5,5,Ruijie,,0-0-0-10-0-0-6-0-0-9-0-0-1-0-0-0
1038,60,7,"Same, Confirm(User_ID=1, Height)","In this new win, is it a win because some pieces are short?",Negate(),"No, that is not the reason.",Tianyi,4,5,Ruijie,,0-0-0-10-0-0-6-0-0-9-0-0-1-0-0-0
1038,60,8,"Context Switch, Confirm(User_ID=1, AddPiece(0,0))","Back to this board, if I put a new piece at the left corner, can it still be a win?",NotSure(),"Sorry, I am not sure about this.",Tianyi,5,5,Ruijie,,0-0-0-7-0-0-0-13-0-0-0-11-0-0-0-5
1038,60,9,RequestNewWinCondition(),Can you give me another new win?,Inform,Assume you demonstrate this win condition,Tianyi,5,5,Ruijie,,0-0-0-15-0-0-7-0-0-8-0-0-13-0-0-0
1038,60,10,"Same, Confirm(User_ID=1, Rotate(90))","In this case, If I rotate all pieces 90 degrees to the rows and put them in the first column, can it still be a winning board?",NotSure(),I am uncertain about this.,Tianyi,5,5,Ruijie,,0-0-0-15-0-0-7-0-0-8-0-0-13-0-0-0
1038,60,11,"Same, Confirm(User_ID=1, Quantity)","And, is it a win because there are four pieces on the board?",Affirm(),"Yes, you are right.",Tianyi,5,4,Ruijie,,0-0-0-15-0-0-7-0-0-8-0-0-13-0-0-0
1038,60,12,Finish(),Thank you for your sharing.,Finish,You are welcome.,Tianyi,5,5,Ruijie,,0-0-0-15-0-0-7-0-0-8-0-0-13-0-0-0
