dialog_id,CooperativityRate,Turn Exchange,Formal System Query,NL System Query,Formal User Response,User Response,NL_Student,Correctness Rate,Naturalness Rate,Evaluator,Comments,Board
185,100,0,Start(),"Hi, can you teach me how to play Quarto?",Start,Sure!,Shaobo,5,5,Anthony,,0-0-0-0-0-0-0-0-0-0-0-0-0-0-0-0
185,100,1,RequestNewWinCondition(),Could you show a win?,Inform(),Assume you demonstrate this win condition,Shaobo,5,4,Anthony,,0-0-0-0-0-0-0-0-0-0-0-0-8-2-12-10
185,100,2,RequestNewWinCondition(),Could you show me another win?,Inform(),Assume you demonstrate this win condition,Shaobo,5,5,Anthony,,7-0-0-0-0-9-0-0-0-0-1-0-0-0-0-15
185,100,3,RequestNewWinCondition(),Can you show me one more win condition?,Inform(),Assume you demonstrate this win condition,Shaobo,5,5,Anthony,,14-0-0-0-0-16-0-0-0-0-13-0-0-0-0-12
185,100,4,"Same, RequestOtherPlayers()",How could another player revoke this win?,Inform([]),There is nothing he or she could do after you have won.,Shaobo,5,5,Anthony,,14-0-0-0-0-16-0-0-0-0-13-0-0-0-0-12
185,100,5,"Same, Confirm(User_ID=1, Height)",So is this board a win because of the heights of pieces?,Affirm(),"Yes, it is a win because all pieces are tall.",Shaobo,3,4,Anthony,,14-0-0-0-0-16-0-0-0-0-13-0-0-0-0-12
185,100,6,"Win Same {'ActionName': 'Confirm_Hollowness', 'FirstPart': None, 'ID': 1, 'SecondPart': None}",And is it a win also because of the hollowness of the pieces?,Negate(),"No, the pieces are neither all hollow nor all solid.",Shaobo,5,5,Anthony,,14-0-0-0-0-16-0-0-0-0-13-0-0-0-0-12
185,100,7,"Win Context Switch {'ActionName': 'Confirm_Hollowness', 'FirstPart': None, 'ID': 1, 'SecondPart': None}","For this board, is it a win also because of the hollowness of the pieces?",Negate(),"No, it is win because all pieces have same color.",Shaobo,3,4,Anthony,,0-0-0-0-0-0-0-0-0-0-0-0-8-2-12-10
185,100,8,"Context Switch, Confirm(User_ID=1, Color)","For this board, is it a win because of the colors of pieces?",Negate(),"No, it is win because all pieces are tall.",Shaobo,3,5,Anthony,I'm not sure if adding the extra information is correct.,14-0-0-0-0-16-0-0-0-0-13-0-0-0-0-12
185,100,9,"Context Switch, Request(User_ID=1, Translate)","For this board, how could I translate the pieces so that it is still a win?","Inform(['row1', 'row2', 'row3'])",You could move the pieces to any other rows.,Shaobo,5,4,Anthony,*row,0-0-0-0-0-0-0-0-0-0-0-0-8-2-12-10
185,100,10,"Context Switch, Confirm(User_ID=1, Shape)","For this board, is it a win because of the shapes of pieces?",Negate(),"No, it is win because they are all tall pieces.",Shaobo,3,5,Anthony,,14-0-0-0-0-16-0-0-0-0-13-0-0-0-0-12
185,100,11,Finish(),Thanks! I got a lot useful information!,Finish,You are welcome!,Shaobo,5,5,Anthony,,14-0-0-0-0-16-0-0-0-0-13-0-0-0-0-12
