dialog_id,CooperativityRate,Turn Exchange,Formal System Query,NL System Query,Formal User Response,User Response,NL_Student,Correctness Rate,Naturalness Rate,Evaluator,Comments,Board
1280,60,0,Start(),"Hi, could you teach me how to play Quarto?",Start,Sure!,Shaobo,5,5,John,,0-0-0-0-0-0-0-0-0-0-0-0-0-0-0-0
1280,60,1,RequestNewWinCondition(),Could you show me a win first?,Inform,Assume you demonstrate this win condition,Shaobo,5,5,John,,0-0-12-0-0-0-7-0-0-0-15-0-0-0-16-0
1280,60,2,"Same, Confirm(User_ID=1, Translate([0, 3]))",And is it still a win if I shift the pieces to rightmost column?,Affirm(),"Yes, it is still a win.",Shaobo,5,5,John,,0-0-12-0-0-0-7-0-0-0-15-0-0-0-16-0
1280,60,3,"Same, Confirm(User_ID=1, Translate([0, 1]))",And is it still a win if I shift the pieces to the second left column?,Affirm(),"Yes, it is still a win.",Shaobo,5,4,John,,0-0-12-0-0-0-7-0-0-0-15-0-0-0-16-0
1280,60,4,"Same, RequestOtherPlayers()",And how could another player revoke this win?,Inform([]),There is nothing that another player could do to prevent this win.,Shaobo,5,5,John,,0-0-12-0-0-0-7-0-0-0-15-0-0-0-16-0
1280,60,5,"Same, Confirm(User_ID=1, Translate([0, 3]))",And is it still a win if I shift the pieces to the rightmost column?,Affirm(),"Yes, it is still a win.",Shaobo,5,5,John,,0-0-12-0-0-0-7-0-0-0-15-0-0-0-16-0
1280,60,6,RequestNewWinCondition(),Is there any other way to win?,Inform,Assume you demonstrate this win condition,Shaobo,4,5,John,,0-0-0-7-0-0-13-0-0-6-0-0-8-0-0-0
1280,60,7,RequestNewWinCondition(),Could you show me another winning board?,Inform,Assume you demonstrate this win condition,Shaobo,5,5,John,,15-0-0-0-0-16-0-0-0-0-8-0-0-0-0-14
1280,60,8,RequestNewWinCondition(),Could you show me one more winning board?,Inform,Assume you demonstrate this win condition,Shaobo,5,5,John,,0-0-0-0-0-0-0-0-0-0-0-0-2-14-5-6
1280,60,9,"Context Switch, RequestOtherPlayers()","Switching to this board, how could another player revoke this win?",Inform([]),There is nothing that another player could do to prevent this win.,Shaobo,5,5,John,,15-0-0-0-0-16-0-0-0-0-8-0-0-0-0-14
1280,60,10,RequestNewWinCondition(),Could you show me one more winning board?,Inform,Assume you demonstrate this win condition,Shaobo,5,5,John,,12-0-0-0-0-11-0-0-0-0-8-0-0-0-0-3
1280,60,11,"Context Switch, Confirm(User_ID=1, Translate([0, 3]))","Switching to this board, is it still a win if I shift the pieces to the rightmost column?",NotSure(),"Sorry, I am not sure about it.",Shaobo,5,4,John,,0-0-12-0-0-0-7-0-0-0-15-0-0-0-16-0
1280,60,12,"Context Switch, Confirm(User_ID=1, Height)","Switching to this board, is it a win because of the height of the pieces?",Negate(),"No, it is a win because all pieces have the same shape.",Shaobo,5,5,John,,0-0-0-7-0-0-13-0-0-6-0-0-8-0-0-0
1280,60,13,RequestNewWinCondition(),I need one more winning board for a better understanding.,Inform,Assume you demonstrate this win condition,Shaobo,5,4,John,,11-0-0-0-0-15-0-0-0-0-13-0-0-0-0-16
1280,60,14,Finish(),Thanks for the help! I have learned a lot!,Finish,You are welcome!,Shaobo,5,5,John,,11-0-0-0-0-15-0-0-0-0-13-0-0-0-0-16
