dialog_id,CooperativityRate,Turn Exchange,Formal System Query,NL System Query,Formal User Response,User Response,NL_Student,Correctness Rate,Naturalness Rate,Evaluator,Comments,Board
1271,60,0,Start(),"Hi, could you please tell me how to play Quarto?",Start,Sure!,Shaobo,5,5,John,,0-0-0-0-0-0-0-0-0-0-0-0-0-0-0-0
1271,60,1,RequestNewWinCondition(),Could you show me a win first?,Inform,Assume you demonstrate this win condition,Shaobo,5,5,John,,15-0-0-0-0-8-0-0-0-0-6-0-0-0-0-7
1271,60,2,RequestNewWinCondition(),Is there any other way to win?,Inform,Assume you demonstrate this win condition,Shaobo,5,5,John,,0-0-0-14-0-0-0-1-0-0-0-10-0-0-0-5
1271,60,3,"Same, Request(User_ID=1, Translate)",And how could I shift the pieces and still keep the win?,"Inform(['col1', 'col2'])",You could shift them to the second ot the third row.,Shaobo,2,5,John,,0-0-0-14-0-0-0-1-0-0-0-10-0-0-0-5
1271,60,4,"Same, Confirm(User_ID=1, Shape)",And is it a win because of the shape of the pieces?,NotSure(),I don't think so but I am not sure.,Shaobo,4,5,John,,0-0-0-14-0-0-0-1-0-0-0-10-0-0-0-5
1271,60,5,"Context Switch, Confirm(User_ID=1, Rotate(90))","Switching to this board, is it still a win if I rotate the pieces to the first column?",NotSure(),I think so but I am not very sure.,Shaobo,3,5,John,,15-0-0-0-0-8-0-0-0-0-6-0-0-0-0-7
1271,60,6,"Context Switch, Confirm(User_ID=1, Rotate(180))","Switching to this board, is it still a win if I rotate the pieces to the first row?",Affirm(),"Yes, it is still a win.",Shaobo,5,5,John,,0-0-0-14-0-0-0-1-0-0-0-10-0-0-0-5
1271,60,7,RequestNewWinCondition(),Could you show me one more winning board?,Inform,Assume you demonstrate this win condition,Shaobo,5,5,John,,0-0-0-15-0-0-3-0-0-8-0-0-11-0-0-0
1271,60,8,"Same, Confirm(User_ID=1, Height)",And is it a win because of the height of the pieces?,Negate()," No, it is a win because all pieces are hollow.",Shaobo,5,5,John,,0-0-0-15-0-0-3-0-0-8-0-0-11-0-0-0
1271,60,9,"Context Switch, Confirm(User_ID=1, AddPiece(0,0))","Switching to this board, is it still a win if I add a piece on the bottom left corner?",Affirm(),"Yes, it is still a win.",Shaobo,5,5,John,,15-0-0-0-0-8-0-0-0-0-6-0-0-0-0-7
1271,60,10,"Same, Confirm(User_ID=1, Hollowness)",And is it a win because of the hollowness of the pieces?,Negate(),"No, it is a win because all pieces have the same shape.",Shaobo,5,5,John,,15-0-0-0-0-8-0-0-0-0-6-0-0-0-0-7
1271,60,11,RequestNewWinCondition(),Could you show me one more winning board?,Inform,Assume you demonstrate this win condition,Shaobo,5,5,John,,16-0-0-0-0-14-0-0-0-0-13-0-0-0-0-10
1271,60,12,RequestNewWinCondition(),I need one more winning board for a better understanding.,Inform,Assume you demonstrate this win condition,Shaobo,5,4,John,,0-0-0-0-0-0-0-0-0-0-0-0-7-16-15-6
1271,60,13,"Context Switch, Confirm(User_ID=1, Height)","Switching to this board, is it a win because of the height of the pieces?",NotSure(),"Sorry, I am not sure about it.",Shaobo,5,3,John,,0-0-0-15-0-0-3-0-0-8-0-0-11-0-0-0
1271,60,14,"Context Switch, Confirm(User_ID=1, AddPiece(2,3))","Switching to this board, is it still a win if I add a piece on the third bottom row and the rightmost column?",NotSure(),I think so but I am not very sure.,Shaobo,4,4,John,,0-0-0-0-0-0-0-0-0-0-0-0-7-16-15-6
1271,60,15,Finish(),Thanks for the help! I have learned a lot!,Finish,You are welcome!,Shaobo,5,5,John,,0-0-0-0-0-0-0-0-0-0-0-0-7-16-15-6
