dialog_id,CooperativityRate,Turn Exchange,Formal System Query,NL System Query,Formal User Response,User Response,NL_Student,Correctness Rate,Naturalness Rate,Evaluator,Comments,Board
1035,60,0,Start(),"Hi, can you give me some advice on playing Quarto?",Start,Ok.,Tianyi,5,5,Ruijie,,0-0-0-0-0-0-0-0-0-0-0-0-0-0-0-0
1035,60,1,RequestNewWinCondition(),Can you give me an example of win?,Inform,Assume you demonstrate this win condition,Tianyi,5,5,Ruijie,,0-0-0-16-0-0-0-15-0-0-0-14-0-0-0-12
1035,60,2,RequestNewWinCondition(),Can you give me another example of win?,Inform,Assume you demonstrate this win condition,Tianyi,5,4,Ruijie,,5-0-0-0-0-2-0-0-0-0-7-0-0-0-0-1
1035,60,3,"Context Switch, Confirm(User_ID=1, Color)","For this board, is it wins because most pieces are blue?",NotSure(),I am not sure about this.,Tianyi,5,5,Ruijie,,0-0-0-16-0-0-0-15-0-0-0-14-0-0-0-12
1035,60,4,RequestNewWinCondition(),Can you show me a new winning board?,Inform,Assume you demonstrate this win condition,Tianyi,5,5,Ruijie,,2-0-0-0-0-10-0-0-0-0-6-0-0-0-0-4
1035,60,5,RequestNewWinCondition(),Can you show me another new winning board?,Inform,Assume you demonstrate this win condition,Tianyi,5,5,Ruijie,,3-0-0-0-0-12-0-0-0-0-9-0-0-0-0-11
1035,60,6,"Context Switch, Confirm(User_ID=1, Rotate(180))","In this case, If I rotate all pieces 180 degrees from the rows and put them in the top row, can it still be a winning board?",NotSure(),I am uncertain about this.,Tianyi,5,4,Ruijie,,0-0-0-16-0-0-0-15-0-0-0-14-0-0-0-12
1035,60,7,RequestNewWinCondition(),Can you show me a new win pattern?,Inform,Assume you demonstrate this win condition,Tianyi,5,5,Ruijie,,0-0-0-3-0-0-0-8-0-0-0-12-0-0-0-4
1035,60,8,"Context Switch, Confirm(User_ID=1, AddPiece(3,2))","In this winning board, if I put a new piece at the third column of the top row, can it still be a win?",NotSure(),I have no idea about this.,Tianyi,5,5,Ruijie,,5-0-0-0-0-2-0-0-0-0-7-0-0-0-0-1
1035,60,9,"Context Switch, Request(User_ID=1, Rotate)","In this case, can I rotate some pieces and still maintain the win?","Inform([135, 180])","Yes, you can rotate all pieces 135 degrees from the rows and put them in the antidiagonal, or you can rotate all pieces 180 degrees from the rows and put them in the top row.",Tianyi,5,4,Ruijie,,0-0-0-3-0-0-0-8-0-0-0-12-0-0-0-4
1035,60,10,"Same, Confirm(User_ID=1, Translate([0, 2]))","For this board, if I move all pieces one block left, can it still be a win?",Affirm(),"Yes, it will still be a win.",Tianyi,5,5,Ruijie,,0-0-0-3-0-0-0-8-0-0-0-12-0-0-0-4
1035,60,11,"Context Switch, Confirm(User_ID=1, RemovePiece(0,3))","In this win, if I remove the piece at the rightmost column, is it still a win?",NotSure(),I cannot determine whether that is true.,Tianyi,5,5,Ruijie,,3-0-0-0-0-12-0-0-0-0-9-0-0-0-0-11
1035,60,12,"Context Switch, Confirm(User_ID=1, Shape)","In this board, is it wins because of the shape of the pieces?",Negate(),"Nope, that is not related.",Tianyi,5,5,Ruijie,,5-0-0-0-0-2-0-0-0-0-7-0-0-0-0-1
1035,60,13,"Context Switch, Request(User_ID=1, Translate)","For this board, can I move some pieces and still keep the win?",Inform(['col1']),"Yes, you can move all pieces to the second column.",Tianyi,4,5,Ruijie,,0-0-0-3-0-0-0-8-0-0-0-12-0-0-0-4
1035,60,14,"Context Switch, Confirm(User_ID=1, Color)","For this board, is it wins because most pieces are blue?",Negate(),"No, that is not the reason.",Tianyi,5,5,Ruijie,,0-0-0-16-0-0-0-15-0-0-0-14-0-0-0-12
1035,60,15,Finish(),Thank you for your advice.,Finish,You are welcome.,Tianyi,5,5,Ruijie,,0-0-0-16-0-0-0-15-0-0-0-14-0-0-0-12
