dialog_id,CooperativityRate,Turn Exchange,Formal System Query,NL System Query,Formal User Response,User Response,NL_Student,Correctness Rate,Naturalness Rate,Evaluator,Comments,Board
651,60,0,Start(),"Hi, can you please give me some advice on playing Quarto?",Start,Sure.,Yiyan,5,5,Tianyi,,0-0-0-0-0-0-0-0-0-0-0-0-0-0-0-0
651,60,1,RequestNewWinCondition(),Thanks. Could you first show me a win board?,Inform,Assume you demonstrate this win condition,Yiyan,5,5,Tianyi,,6-0-0-0-0-12-0-0-0-0-10-0-0-0-0-16
651,60,2,"Same, Request(User_ID=1, Rotate)","For this win condition, how can I rotate the pieces to get another win?",Inform([90]),You are rotate them to the last column.,Yiyan,5,5,Tianyi,,6-0-0-0-0-12-0-0-0-0-10-0-0-0-0-16
651,60,3,RequestNewWinCondition(),Can you show me another win board?,Inform,Assume you demonstrate this win condition,Yiyan,5,5,Tianyi,,0-0-0-6-0-0-3-0-0-2-0-0-7-0-0-0
651,60,4,"Same, Request(User_ID=1, Rotate)","For this win condition, how can I rotate the pieces to get another win?",Inform([90]),You can rotate the pieces to the first column.,Yiyan,5,5,Tianyi,,0-0-0-6-0-0-3-0-0-2-0-0-7-0-0-0
651,60,5,RequestNewWinCondition(),Is there any other way to win?,Inform,Assume you demonstrate this win condition,Yiyan,5,5,Tianyi,,0-0-0-0-0-0-0-0-0-0-0-0-15-13-8-16
651,60,6,"Same, Confirm(User_ID=1, RemovePiece(0,0))","For the same board, can I still get a win if the piece on the bottom left gets removed?",Negate(),"No, in that case it will not be a win any more.",Yiyan,5,5,Tianyi,,0-0-0-0-0-0-0-0-0-0-0-0-15-13-8-16
651,60,7,"Context Switch, Request(User_ID=1, Rotate)","Let's switch to this win board, is there any way to rotate the pieces while maintaining the win?",Inform([90]),You can rotate them to the last column.,Yiyan,5,5,Tianyi,,6-0-0-0-0-12-0-0-0-0-10-0-0-0-0-16
651,60,8,"Context Switch, Confirm(User_ID=1, Color)","For this won scenario, is it a win because of the color of the pieces?",Negate(),"No, as you can see, they have differnet colors.",Yiyan,5,5,Tianyi,,0-0-0-0-0-0-0-0-0-0-0-0-15-13-8-16
651,60,9,"Context Switch, Confirm(User_ID=1, RemovePiece(3,0))","For this now winning condition, I guess that I can still get a win if I removed the pieces on the top left corner, is this correct?",Negate(),"No, you are wrong, since you must have at least four pieces to win.",Yiyan,5,5,Tianyi,,6-0-0-0-0-12-0-0-0-0-10-0-0-0-0-16
651,60,10,"Same, RequestOtherPlayers()","For the same board, how can the other player do to stop this win?",Inform([]),There is nothing he or she can do. ,Yiyan,5,5,Tianyi,,6-0-0-0-0-12-0-0-0-0-10-0-0-0-0-16
651,60,11,"Context Switch, Confirm(User_ID=1, Height)","Let's consider this board, is it a win because of the heights of the pieces?",Negate(),"No, it is a win because all the pieces have the same shape.",Yiyan,5,4,Tianyi,,0-0-0-0-0-0-0-0-0-0-0-0-15-13-8-16
651,60,12,RequestNewWinCondition(),Can you show me another way to win?,Inform,Assume you demonstrate this win condition,Yiyan,5,5,Tianyi,,0-0-0-0-0-0-0-0-0-0-0-0-5-1-15-13
651,60,13,"Context Switch, Request(User_ID=1, Rotate)","For this win scenario,how can I rotate the pieces to get another win?",Inform([90]),You can rotate them to the last column.,Yiyan,5,4,Tianyi,,6-0-0-0-0-12-0-0-0-0-10-0-0-0-0-16
651,60,14,"Same, Confirm(User_ID=1, Shape)","For the same board, is it a win because of the shapes of the pieces?",Negate(),"No, the real reason is that all the pieces have the same color.",Yiyan,5,5,Tianyi,,6-0-0-0-0-12-0-0-0-0-10-0-0-0-0-16
651,60,15,Finish(),"Thank you. I can play Quarto now, would you like to play with me?",Finish,Sure.,Yiyan,5,5,Tianyi,,6-0-0-0-0-12-0-0-0-0-10-0-0-0-0-16
