dialog_id,CooperativityRate,Turn Exchange,Formal System Query,NL System Query,Formal User Response,User Response,NL_Student,Correctness Rate,Naturalness Rate,Evaluator,Comments,Board
82,100,0,Start(),Can you teach me how to play Quarto?,Start,Yes I can.,Derek,5,5,Jacob,,0-0-0-0-0-0-0-0-0-0-0-0-0-0-0-0
82,100,1,RequestNewWinCondition(),Please show me a win condition.,Inform(),Assume you demonstrate this win condition,Derek,5,5,Jacob,,0-10-0-0-0-9-0-0-0-13-0-0-0-11-0-0
82,100,2,RequestNewWinCondition(),Please show me another win condition.,Inform(),Assume you demonstrate this win condition,Derek,5,5,Jacob,,5-0-0-0-0-13-0-0-0-0-8-0-0-0-0-16
82,100,3,RequestNewWinCondition(),Can you show me one more win condition please?,Inform(),Assume you demonstrate this win condition,Derek,5,5,Jacob,,7-0-0-0-0-3-0-0-0-0-8-0-0-0-0-5
82,100,4,"Same, Request(User_ID=1, Translate)","For the last win condition you show me, can I do any translation for the pieces and keep winning?",Inform([]),Yes you have many ways.,Derek,2,5,Jacob,The user here is saying that there is no way to translate these pieces in this orientation for a new win condition.,7-0-0-0-0-3-0-0-0-0-8-0-0-0-0-5
82,100,5,"Same, Confirm(User_ID=1, Rotate(90))",Is that still a win if I put all the pieces vertically?,Affirm(),"Sure you can do that,",Derek,5,5,Jacob,,7-0-0-0-0-3-0-0-0-0-8-0-0-0-0-5
82,100,6,"Same , Confirm(User_ID=1, Color)",Is that a win because of the color pattern of these pieces?,Negate(),No it's not,Derek,5,5,Jacob,,7-0-0-0-0-3-0-0-0-0-8-0-0-0-0-5
82,100,7,"Context Switch, RequestOtherPlayers()","For the first win condition, could another player prevent that win?",Inform([]),"No, this win condition is absolute.",Derek,5,5,Jacob,,0-10-0-0-0-9-0-0-0-13-0-0-0-11-0-0
82,100,8,"Win Context Switch {'ActionName': 'Confirm_Hollowness', 'FirstPart': None, 'ID': 1, 'SecondPart': None}","For the third win condition you showed, is that a win because of the hollowness of the pieces?",Negate(),No the hollowness of pieces is no the reason to win.,Derek,5,4,Jacob,"Replace ""no the reason"" with ""not the reason.""",7-0-0-0-0-3-0-0-0-0-8-0-0-0-0-5
82,100,9,"Same , Confirm(User_ID=1, RemovePiece(3,0))",Can I remove the piece at bottom right and keep winning?,Negate(),No it will no loger be a win if you remove that.,Derek,5,4,Jacob,"Replace ""loger"" with ""longer.""",7-0-0-0-0-3-0-0-0-0-8-0-0-0-0-5
82,100,10,"Win Context Switch {'ActionName': 'Confirm_Hollowness', 'FirstPart': None, 'ID': 1, 'SecondPart': None}","Let's go back to the first win condition, is that a win because the hollowness of pieces?",Negate(),No it's not the reason.,Derek,5,5,Jacob,,0-10-0-0-0-9-0-0-0-13-0-0-0-11-0-0
82,100,11,"Same, RequestOtherPlayers()",Can another player prevent that win?,Inform([]),"No, this win is absolute.",Derek,4,5,Jacob,"The system is asking what actions another player can take to prevent this win, not just if they exist.",0-10-0-0-0-9-0-0-0-13-0-0-0-11-0-0
82,100,12,"Context Switch, Request(User_ID=1, Translate)","For the second win condition, is there any translation I can make and keep winning?",Inform([]),"Yes, you have many ways to do that.",Derek,2,5,Jacob,"Once again, there are no ways to translate these pieces.",5-0-0-0-0-13-0-0-0-0-8-0-0-0-0-16
82,100,13,"Context Switch, Request(User_ID=1, Translate)","For the first win condition, can you show me some translations to the board I can make and keep winning.","Inform(['col0', 'col2', 'col3'])",You are free to set these pieces at any column of the board.,Derek,5,5,Jacob,,0-10-0-0-0-9-0-0-0-13-0-0-0-11-0-0
82,100,14,"Same, RequestOtherPlayers()",Could another player prevent it?,Inform([]),"No, another player can not prevent it.",Derek,5,3,Jacob,The NL query seems too vague to be easily understood without the the formal query.,0-10-0-0-0-9-0-0-0-13-0-0-0-11-0-0
82,100,15,Finish(),Ok! Thank you so much. I learned a lot.,Finish,No problem!,Derek,5,5,Jacob,,0-10-0-0-0-9-0-0-0-13-0-0-0-11-0-0
