dialog_id,CooperativityRate,Turn Exchange,Formal System Query,NL System Query,Formal User Response,User Response,NL_Student,Correctness Rate,Naturalness Rate,Evaluator,Comments,Board
42,100,0,Start(),Let's start Quarto!,Start,You got it.,Luke,4,4,John,,0-0-0-0-0-0-0-0-0-0-0-0-0-0-0-0
42,100,1,RequestNewWinCondition(),Can I see a win condition?,Inform(),Assume you demonstrate this win condition,Luke,5,5,John,,5-0-0-0-0-6-0-0-0-0-15-0-0-0-0-7
42,100,2,"Same, Request(User_ID=1, Rotate)",Can I rotate these pieces?,Inform([90]),"Yes, you can rotate them by 90 degrees.",Luke,3,4,John,,5-0-0-0-0-6-0-0-0-0-15-0-0-0-0-7
42,100,3,RequestNewWinCondition(),Give me a new win condition.,Inform(),Assume you demonstrate this win condition,Luke,5,5,John,,0-13-0-0-0-12-0-0-0-14-0-0-0-9-0-0
42,100,4,RequestNewWinCondition(),Let me see one other win condition.,Inform(),Assume you demonstrate this win condition,Luke,5,5,John,,0-0-0-0-0-0-0-0-0-0-0-0-12-8-4-10
42,100,5,"Same , Confirm(User_ID=1, Shape)",Is the shape of the tiles the reason for the win?,Negate(),"Actually no, the shapes are not the reason for the win.",Luke,5,5,John,,0-0-0-0-0-0-0-0-0-0-0-0-12-8-4-10
42,100,6,RequestNewWinCondition(),I am still frustrated. Show me another win condition.,Inform(),Assume you demonstrate this win condition,Luke,5,5,John,,9-0-0-0-0-3-0-0-0-0-11-0-0-0-0-13
42,100,7,"Context Switch, Confirm(User_ID=1, Color)","For the first win condition you showed me, how does the color affect whether or not this board is a win?",Negate(),Color has no affect on the reason for why this arrangement of tiles is a win.,Luke,4,5,John,,5-0-0-0-0-6-0-0-0-0-15-0-0-0-0-7
42,100,8,"Context Switch, RequestOtherPlayers()",How do other players' actions change if this is a win or not?,Inform([]),Other players' actions cannot change the fact that this is a winning board.,Luke,4,5,John,,0-0-0-0-0-0-0-0-0-0-0-0-12-8-4-10
42,100,9,"Context Switch, Request(User_ID=1, Rotate)",Let me see the board where the tiles were aligned along the second column. How can I rotate these pieces?,Inform([]),There are no rotations you can perform on the board without violation the conditions needed for a win.,Luke,5,3,John,,0-13-0-0-0-12-0-0-0-14-0-0-0-9-0-0
42,100,10,"Context Switch, Confirm(User_ID=1, Shape)",One of the boards you showed to me had three triangles and one circle along the diagonal. How does the shape of these tiles change the win?,Negate(),Changing the shape of the tiles does not have any influence on the win condition.,Luke,4,3,John,,9-0-0-0-0-3-0-0-0-0-11-0-0-0-0-13
42,100,11,"Context Switch, Confirm(User_ID=1, Color)","For the board with the pieces along the bottom row, is this a win because of the color of the tiles?",Affirm(),"Yes, this is the reason for the win.",Luke,5,4,John,,0-0-0-0-0-0-0-0-0-0-0-0-12-8-4-10
42,100,12,RequestNewWinCondition(),Can I see another win condition?,Inform(),Assume you demonstrate this win condition,Luke,5,5,John,,0-0-0-9-0-0-0-2-0-0-0-10-0-0-0-11
42,100,13,RequestNewWinCondition(),Show me one more winning board.,Inform(),Assume you demonstrate this win condition,Luke,5,5,John,,16-0-0-0-0-15-0-0-0-0-4-0-0-0-0-12
42,100,14,"Context Switch, Request(User_ID=1, Translate)","For this board here, how can I translate this column of tiles?","Inform(['col0', 'col2', 'col3'])",You can translate it left one column as well as right one or two columns.,Luke,5,4,John,translate is not a natural word,0-13-0-0-0-12-0-0-0-14-0-0-0-9-0-0
42,100,15,Finish(),I think I've learned all that I need. Thanks!,Finish,No problem chief!,Luke,5,5,John,,0-13-0-0-0-12-0-0-0-14-0-0-0-9-0-0
