dialog_id,CooperativityRate,Turn Exchange,Formal System Query,NL System Query,Formal User Response,User Response,NL_Student,Correctness Rate,Naturalness Rate,Evaluator,Comments,Board
790,60,0,Start(),Can you teach me how to play Quarto?,Start,"Sure, let's start.",Derek,5,5,Shaobo,,0-0-0-0-0-0-0-0-0-0-0-0-0-0-0-0
790,60,1,RequestNewWinCondition(),Can you show me a win condition to start?,Inform,Assume you demonstrate this win condition,Derek,5,5,Shaobo,,0-0-3-0-0-0-4-0-0-0-11-0-0-0-1-0
790,60,2,RequestNewWinCondition(),Please show me one more win condition.,Inform,Assume you demonstrate this win condition,Derek,5,5,Shaobo,,0-0-0-15-0-0-9-0-0-16-0-0-13-0-0-0
790,60,3,"Same, Confirm(User_ID=1, Height)",Is the height of pieces important for this win?,NotSure(),"Sorry, I don't know.",Derek,5,5,Shaobo,,0-0-0-15-0-0-9-0-0-16-0-0-13-0-0-0
790,60,4,"Context Switch, Confirm(User_ID=1, Translate([0, 3]))",Go back to this win. Can I shift all piece to the right and keep winning?,NotSure(),Sorry I am not sure about that as well.,Derek,4,5,Shaobo,,0-0-3-0-0-0-4-0-0-0-11-0-0-0-1-0
790,60,5,"Context Switch, Confirm(User_ID=1, Shape)","Switching to this board, 
is that a win because the shape pattern of all pieces?",NotSure(),Sorry I don't know that as well.,Derek,5,5,Shaobo,,0-0-0-15-0-0-9-0-0-16-0-0-13-0-0-0
790,60,6,"Same, Confirm(User_ID=1, Height)",Is that a win because the height pattern of all pieces?,NotSure(),I don't know.,Derek,5,5,Shaobo,,0-0-0-15-0-0-9-0-0-16-0-0-13-0-0-0
790,60,7,"Same, Request(User_ID=1, Rotate)",Do you know how can I aline these pieces and keep winning?,Inform([90]),You can aline them vertically.,Derek,4,4,Shaobo,,0-0-0-15-0-0-9-0-0-16-0-0-13-0-0-0
790,60,8,"Context Switch, RequestOtherPlayers()",How could another player undo this win showed on board?,Inform([]),There is nothing another player could do to prevent this win.,Derek,5,4,Shaobo,,0-0-3-0-0-0-4-0-0-0-11-0-0-0-1-0
790,60,9,"Same, Confirm(User_ID=1, Hollowness)",Is the hollowness of pieces important for this win?,NotSure(),"No, it is not the reason this board is a win.",Derek,5,5,Shaobo,,0-0-3-0-0-0-4-0-0-0-11-0-0-0-1-0
790,60,10,RequestNewWinCondition(),Please show me one more win condition.,Inform,Assume you demonstrate this win condition,Derek,5,5,Shaobo,,0-0-0-0-0-0-0-0-0-0-0-0-12-9-13-14
790,60,11,"Same, Request(User_ID=1, Translate)",How can I shift these pieces and keep winning?,"Inform(['row1', 'row2', 'row3'])",You can place them in any row in the board.,Derek,5,5,Shaobo,,0-0-0-0-0-0-0-0-0-0-0-0-12-9-13-14
790,60,12,Finish(),Thank you for teaching me today! ,Finish,You are welcome.,Derek,5,5,Shaobo,,0-0-0-0-0-0-0-0-0-0-0-0-12-9-13-14
