dialog_id,CooperativityRate,Turn Exchange,Formal System Query,NL System Query,Formal User Response,User Response,NL_Student,Correctness Rate,Naturalness Rate,Evaluator,Comments,Board
119,100,0,Start(),"Hi, could you teach me how to play Quarto?",Start,Sure!,Shaobo,5,5,Yiyen,,0-0-0-0-0-0-0-0-0-0-0-0-0-0-0-0
119,100,1,RequestNewWinCondition(),Can you show me a win condition?,Inform(),Assume you demonstrate this win condition,Shaobo,5,5,Yiyen,,6-0-0-0-7-0-0-0-5-0-0-0-1-0-0-0
119,100,2,"Win Same {'ActionName': 'Confirm_Hollowness', 'FirstPart': None, 'ID': 1, 'SecondPart': None}","For the board you just showed me, is it a win because they are all hollow or all solid?",Negate(),"No, as you can see, one piece is hollow and others are solid.",Shaobo,5,5,Yiyen,,6-0-0-0-7-0-0-0-5-0-0-0-1-0-0-0
119,100,3,"Same , Confirm(User_ID=1, AddPiece(0,1))","For the same board, is it still a win if I add a piece on the first row and the second column?",Affirm(),"Yes, it is still a win.",Shaobo,5,5,Yiyen,,6-0-0-0-7-0-0-0-5-0-0-0-1-0-0-0
119,100,4,RequestNewWinCondition(),Could you please show me another winning board?,Inform(),Assume you demonstrate this win condition,Shaobo,5,5,Yiyen,,0-0-0-2-0-0-10-0-0-1-0-0-5-0-0-0
119,100,5,"Same , Confirm(User_ID=1, AddPiece(3,2))","For the board you just showed me, is it still a win if I add a piece on the last row and the third column?",Affirm(),"Yes, it is still a win.",Shaobo,5,5,Yiyen,,0-0-0-2-0-0-10-0-0-1-0-0-5-0-0-0
119,100,6,"Context Switch, Confirm(User_ID=1, Color)",Let's take look at this board. Is it a win because of the colors of pieces?,Negate(),"No, the color of pieces is not the reason for this win. ",Shaobo,5,5,Yiyen,,6-0-0-0-7-0-0-0-5-0-0-0-1-0-0-0
119,100,7,"Win Context Switch {'ActionName': 'Confirm_Hollowness', 'FirstPart': None, 'ID': 1, 'SecondPart': None}","For this board, is it a win because of the hollowness of pieces? ",Affirm(),"Yes, it is win because all pieces are solid.",Shaobo,5,4,Yiyen,,0-0-0-2-0-0-10-0-0-1-0-0-5-0-0-0
119,100,8,"Context Switch, Confirm(User_ID=1, Shape)","For this board, is the shape of pieces the reason why it is a win?",Negate(),"No, the shape of pieces does not lead to a win here.",Shaobo,5,5,Yiyen,,6-0-0-0-7-0-0-0-5-0-0-0-1-0-0-0
119,100,9,"Same , Confirm(User_ID=1, AddPiece(0,3))","For the board we are discussing, if I add a piece on the first row and the last column, is it still a win?",Affirm(),"Yes, it is.",Shaobo,5,5,Yiyen,,6-0-0-0-7-0-0-0-5-0-0-0-1-0-0-0
119,100,10,RequestNewWinCondition(),Could you show me another winning board?,Inform(),Assume you demonstrate this win condition,Shaobo,5,5,Yiyen,,0-0-0-0-0-0-0-0-0-0-0-0-15-14-5-7
119,100,11,"Same, Confirm(User_ID=1, Rotate(45))","For the same board, is it still a win if I move all pieces to the diagonal?",Affirm(),"Yes, it is still a win.",Shaobo,5,5,Yiyen,,0-0-0-0-0-0-0-0-0-0-0-0-15-14-5-7
119,100,12,"Context Switch, Confirm(User_ID=1, Translate('col3'))",Let's take a look at this board. Is it still a win if I move the pieces to the last column.,Affirm,"Yes, it is still a win.",Shaobo,5,5,Yiyen,. -> ?,6-0-0-0-7-0-0-0-5-0-0-0-1-0-0-0
119,100,13,"Context Switch, Request(User_ID=1, Translate)","For this board, how could I translate the pieces so that it is still a win?",Inform([]),There is no way to translate the pieces while keeping the win condition.,Shaobo,5,5,Yiyen,,0-0-0-2-0-0-10-0-0-1-0-0-5-0-0-0
119,100,14,RequestNewWinCondition(),Could you show me one more winning board?,Inform(),Assume you demonstrate this win condition,Shaobo,5,5,Yiyen,,9-0-0-0-5-0-0-0-6-0-0-0-2-0-0-0
119,100,15,Finish(),Thanks for the help!,Finish,You are welcome!,Shaobo,5,5,Yiyen,,9-0-0-0-5-0-0-0-6-0-0-0-2-0-0-0
