dialog_id,CooperativityRate,Turn Exchange,Formal System Query,NL System Query,Formal User Response,User Response,NL_Student,Correctness Rate,Naturalness Rate,Evaluator,Comments,Board
295,50,0,Start(),"Hi, do you think you can teach me how to play Quarto?",Start,"Sure, let's get started.",Jason,,,,,0-0-0-6-0-0-7-0-0-8-0-0-16-0-0-0
295,50,1,RequestNewWinCondition(),Can you show me an example of what a win looks like?,Inform,Assume you demonstrate this win condition,Jason,,,,,0-0-0-0-0-0-0-0-0-0-0-0-14-7-15-8
295,50,2,"Same, Request(User_ID=1, Translate)","Given what you just showed me, what ways you can translate these pieces and still have a win?","Inform(['row1', 'row2'])",You could translate these pieces up one row or two rows.,Jason,,,,,0-0-0-0-0-0-0-0-0-0-0-0-14-7-15-8
295,50,3,RequestNewWinCondition(),Can you show me another example of a winning board?,Inform,Assume you demonstrate this win condition,Jason,,,,,0-0-0-0-0-0-0-0-0-0-0-0-8-6-4-7
295,50,4,RequestNewWinCondition(),Can you show me another way to win Quarto?,Inform,Assume you demonstrate this win condition,Jason,,,,,11-0-0-0-0-12-0-0-0-0-3-0-0-0-0-8
295,50,5,"Context Switch, Confirm(User_ID=1, Rotate(90))","Switching to this board, can you tell me if it's possible to rotate these pieces were rotated 90 degrees and still have a win?",NotSure(),"Hmm, I don't know if doing that will still give you a win.",Jason,,,,,0-0-0-0-0-0-0-0-0-0-0-0-14-7-15-8
295,50,6,"Same, Confirm(User_ID=1, Rotate(45))","Sticking with this board, could you rotate these pieces 45 degrees so that they're in the diagonal and have a win?",Affirm(),"Yeah, you could rotate these pieces that way.",Jason,,,,,0-0-0-0-0-0-0-0-0-0-0-0-14-7-15-8
295,50,7,"Context Switch, Request(User_ID=1, Rotate)","Switching over to this board, how could you rotate these pieces and still have a win?",Inform([45]),You could rotate the pieces 45 degrees so that they're in the diagonal.,Jason,,,,,0-0-0-0-0-0-0-0-0-0-0-0-8-6-4-7
295,50,8,RequestNewWinCondition(),Can you show me another way to win Quarto?,Inform,Assume you demonstrate this win condition,Jason,,,,,0-0-0-14-0-0-6-0-0-2-0-0-16-0-0-0
295,50,9,"Context Switch, Confirm(User_ID=1, RemovePiece(0,2))","Switching to this board right here, could you still have a win if you removed the blue triangle?",NotSure(),I'm not sure if removing that triangle would still give you a win.,Jason,,,,,0-0-0-0-0-0-0-0-0-0-0-0-8-6-4-7
295,50,10,"Context Switch, Confirm(User_ID=1, Color)","Switching to this board now, can you tell me if this is a win because of the color of the pieces?",Affirm(),"Yes, the fact that all these pieces are blue is why it's considered a win.",Jason,,,,,0-0-0-14-0-0-6-0-0-2-0-0-16-0-0-0
295,50,11,"Context Switch, Confirm(User_ID=1, RemovePiece(0,1))","Now with this board, would it still be a win if you removed the hollow green circle?",Negate(),"No, it wouldn't be a win anymore.",Jason,,,,,0-0-0-0-0-0-0-0-0-0-0-0-14-7-15-8
295,50,12,Finish(),Alright I think that's enough from me. Thank you for the help!,Finish,"No problem, anytime.",Jason,,,,,0-0-0-0-0-0-0-0-0-0-0-0-14-7-15-8
