dialog_id,CooperativityRate,Turn Exchange,Formal System Query,NL System Query,Formal User Response,User Response,NL_Student,Correctness Rate,Naturalness Rate,Evaluator,Comments,Board
703,60,0,Start(),Hi! Can you show me how to play Quarto?,Start,"Yes, I'd love to.",Ruijie,5,5,Luke,,0-0-0-0-0-0-0-0-0-0-0-0-0-0-0-0
703,60,1,RequestNewWinCondition(),Can you show me what a win condition looks like?,Inform,Assume you demonstrate this win condition,Ruijie,5,5,Luke,,0-0-0-0-0-0-0-0-0-0-0-0-7-12-15-11
703,60,2,RequestNewWinCondition(),Can you show me a new win?,Inform,Assume you demonstrate this win condition,Ruijie,5,5,Luke,,3-0-0-0-0-9-0-0-0-0-15-0-0-0-0-1
703,60,3,"Same, Confirm(User_ID=1, Hollowness)","Does the hollowness of the pieces make it a win?
",Negate(),"No, that’s not the reason.
",Ruijie,5,5,Luke,,3-0-0-0-0-9-0-0-0-0-15-0-0-0-0-1
703,60,4,"Same, Confirm(User_ID=1, AddPiece(0,2))","Can I add one more piece on the first row, the third column without breaking the win condition?",Affirm(),"Sure, that won't break it.",Ruijie,5,5,Luke,,3-0-0-0-0-9-0-0-0-0-15-0-0-0-0-1
703,60,5,RequestNewWinCondition(),Can you show me a new win?,Inform,Assume you demonstrate this win condition,Ruijie,5,5,Luke,,0-0-0-10-0-0-11-0-0-3-0-0-2-0-0-0
703,60,6,"Same, Confirm(User_ID=1, RemovePiece(3,3))",Can I remove the piece on the right up corner and maintain the win?,NotSure(),"Well, I'm not quite sure.",Ruijie,5,4,Luke,,0-0-0-10-0-0-11-0-0-3-0-0-2-0-0-0
703,60,7,"Same, Confirm(User_ID=1, Shape)","Is it a win because the pieces are of the same shape?
",Affirm(),That’s right.,Ruijie,5,5,Luke,,0-0-0-10-0-0-11-0-0-3-0-0-2-0-0-0
703,60,8,RequestNewWinCondition(),Can you show me a new win?,Inform,Assume you demonstrate this win condition,Ruijie,5,5,Luke,,10-0-0-0-4-0-0-0-8-0-0-0-2-0-0-0
703,60,9,"Same, Confirm(User_ID=1, RemovePiece(3,0))",Can I remove the piece on the top of this board representation?,NotSure(),I'm not sure.,Ruijie,5,5,Luke,,10-0-0-0-4-0-0-0-8-0-0-0-2-0-0-0
703,60,10,RequestNewWinCondition(),Can you show me a new win?,Inform,Assume you demonstrate this win condition,Ruijie,5,5,Luke,,5-0-0-0-0-4-0-0-0-0-8-0-0-0-0-2
703,60,11,Finish(),Thank you so much! I got it!,Finish,You are very welcome!,Ruijie,5,5,Luke,,5-0-0-0-0-4-0-0-0-0-8-0-0-0-0-2
