dialog_id,CooperativityRate,Turn Exchange,Formal System Query,NL System Query,Formal User Response,User Response,NL_Student,Correctness Rate,Naturalness Rate,Evaluator,Comments,Board
95,100,0,Start(),Hello. Could you teach me how to play Quarto?,Start,"Sure, where would you like to begin?",Jacob,5,5,John,,0-0-0-0-0-0-0-0-0-0-0-0-0-0-0-0
95,100,1,RequestNewWinCondition(),Could you show me one way to win this game?,Inform(),Assume you demonstrate this win condition,Jacob,5,5,John,,0-0-0-0-0-0-0-0-0-0-0-0-6-8-10-12
95,100,2,RequestNewWinCondition(),Thanks. Can you show me another?,Inform(),Assume you demonstrate this win condition,Jacob,5,5,John,"This makes sense in the flow of conversation, but I feel like it might be weird for this virtual environment. I.e. another what?",0-0-0-10-0-0-11-0-0-9-0-0-4-0-0-0
95,100,3,"Same , Confirm(User_ID=1, Shape)",Is the shape of these pieces the reason I win here?,Affirm(),"Yes, these pieces all have the same shape.",Jacob,5,4,John,,0-0-0-10-0-0-11-0-0-9-0-0-4-0-0-0
95,100,4,"Same, Confirm(User_ID=1, Height)",Does the height of these pieces contribute to the win?,Negate(),"No, the height is irrelevant here.",Jacob,5,5,John,,0-0-0-10-0-0-11-0-0-9-0-0-4-0-0-0
95,100,5,RequestNewWinCondition(),Can I see another way to win?,Inform(),Assume you demonstrate this win condition,Jacob,5,5,John,,0-0-0-0-0-0-0-0-0-0-0-0-12-11-16-3
95,100,6,RequestNewWinCondition(),Thank you. Might I see one more?,Inform(),Assume you demonstrate this win condition,Jacob,5,5,John,,12-0-0-0-9-0-0-0-16-0-0-0-14-0-0-0
95,100,7,RequestNewWinCondition(),I think I'm starting to understand. Could you show me another winning board?,Inform(),Assume you demonstrate this win condition,Jacob,5,5,John,I like the little starting to understand part,13-0-0-0-0-15-0-0-0-0-11-0-0-0-0-1
95,100,8,"Context Switch, Request(User_ID=1, Rotate)","Going back to this board you showed me, in what ways can I rotate this pattern on the board and still win?","Inform([45, 90])",These pieces can also be aligned either diagonally or vertically for a win.,Jacob,3,5,John,"Try to explain how vertically, since they could be ""vertical"" in any of the columns, specify first column",0-0-0-0-0-0-0-0-0-0-0-0-12-11-16-3
95,100,9,"Context Switch, Confirm(User_ID=1, AddPiece(3,2))","Regarding this board, would I still win if there were a piece added in the third column of the top row?",Affirm(),"Yes, you would still win.",Jacob,5,5,John,"I can't see the full dialogue in the GUI, but I think it seems like you are specifying columns/rows well",12-0-0-0-9-0-0-0-16-0-0-0-14-0-0-0
95,100,10,Finish(),I think I understand enough now to play. Thank you for teaching me.,Finish,No problem. Goodbye.,Jacob,5,5,John,,12-0-0-0-9-0-0-0-16-0-0-0-14-0-0-0
