dialog_id,CooperativityRate,Turn Exchange,Formal System Query,NL System Query,Formal User Response,User Response,NL_Student,Correctness Rate,Naturalness Rate,Evaluator,Comments,Board
1043,60,0,Start(),"Hi, can you give me some advice on playing Quarto?",Start,Sure.,Tianyi,5,4,Ruijie,,0-0-0-0-0-0-0-0-0-0-0-0-0-0-0-0
1043,60,1,RequestNewWinCondition(),Can you show me a win pattern?,Inform,Assume you demonstrate this win condition,Tianyi,5,5,Ruijie,,0-9-0-0-0-12-0-0-0-11-0-0-0-16-0-0
1043,60,2,"Same, Confirm(User_ID=1, RemovePiece(3,1))","In this win, if I remove the piece at the upmost row, is it still a win?",NotSure(),"Sorry, I am uncertain about this.",Tianyi,5,5,Ruijie,,0-9-0-0-0-12-0-0-0-11-0-0-0-16-0-0
1043,60,3,"Same, Confirm(User_ID=1, Quantity)","And, is it a win because there are four pieces on the board?",NotSure(),"That is a good question, I have no idea about this.",Tianyi,5,5,Ruijie,,0-9-0-0-0-12-0-0-0-11-0-0-0-16-0-0
1043,60,4,"Same, Confirm(User_ID=1, RemovePiece(3,1))","If I remove the piece at the fourth row, is it still a win?",Negate(),"No, it will no longer be a win if you do that.",Tianyi,5,4,Ruijie,,0-9-0-0-0-12-0-0-0-11-0-0-0-16-0-0
1043,60,5,RequestNewWinCondition(),Can you give me a new win?,Inform,Assume you demonstrate this win condition,Tianyi,5,5,Ruijie,,12-0-0-0-0-11-0-0-0-0-2-0-0-0-0-10
1043,60,6,"Context Switch, Confirm(User_ID=1, Hollowness)","Back to this board, is it wins because most pieces are hollow?",Negate(),Nope.,Tianyi,5,4,Ruijie,,0-9-0-0-0-12-0-0-0-11-0-0-0-16-0-0
1043,60,7,"Context Switch, Confirm(User_ID=1, RemovePiece(0,3))","In this win, if I remove the piece at the rightmost column, is it still a win?",NotSure(),I am not sure about this.,Tianyi,5,4,Ruijie,,12-0-0-0-0-11-0-0-0-0-2-0-0-0-0-10
1043,60,8,RequestNewWinCondition(),Can you show me another new win?,Inform,Assume you demonstrate this win condition,Tianyi,5,5,Ruijie,,0-0-8-0-0-0-6-0-0-0-15-0-0-0-13-0
1043,60,9,"Same, RequestOtherPlayers()","In this case, can someone take actions to prevent the win?",Inform([]),"No, there is nothing he/she can do.",Tianyi,5,4,Ruijie,,0-0-8-0-0-0-6-0-0-0-15-0-0-0-13-0
1043,60,10,RequestNewWinCondition(),What else can be a winning board?,Inform,Assume you demonstrate this win condition,Tianyi,5,5,Ruijie,,0-0-0-4-0-0-15-0-0-8-0-0-11-0-0-0
1043,60,11,RequestNewWinCondition(),Can you give me a new win pattern?,Inform,Assume you demonstrate this win condition,Tianyi,5,5,Ruijie,,0-0-0-0-0-0-0-0-0-0-0-0-10-15-13-12
1043,60,12,"Context Switch, Confirm(User_ID=1, Shape)","In this board, is it wins because of the shape of the pieces?",NotSure(),I cannot determine whether that is true.,Tianyi,5,4,Ruijie,,0-9-0-0-0-12-0-0-0-11-0-0-0-16-0-0
1043,60,13,"Same, Confirm(User_ID=1, AddPiece(1,3))","And, if I put a new piece at the rightmost column of the second row, can it still be a win?",Affirm(),"Yes, it will be a win.",Tianyi,5,4,Ruijie,,0-9-0-0-0-12-0-0-0-11-0-0-0-16-0-0
1043,60,14,Finish(),Thank you.,Finish,You are welcome.,Tianyi,5,5,Ruijie,,0-9-0-0-0-12-0-0-0-11-0-0-0-16-0-0
