dialog_id,CooperativityRate,Turn Exchange,Formal System Query,NL System Query,Formal User Response,User Response,NL_Student,Correctness Rate,Naturalness Rate,Evaluator,Comments,Board
1026,60,0,Start(),"Hi, can you tell me how to play Quarto?",Start,"Ok, let's start.",Tianyi,5,5,Ruijie,,0-0-0-0-0-0-0-0-0-0-0-0-0-0-0-0
1026,60,1,RequestNewWinCondition(),Can you show me a win pattern?,Inform,Assume you demonstrate this win condition,Tianyi,5,5,Ruijie,,0-0-0-8-0-0-13-0-0-16-0-0-6-0-0-0
1026,60,2,RequestNewWinCondition(),Can you show me another win pattern?,Inform,Assume you demonstrate this win condition,Tianyi,5,5,Ruijie,,0-0-0-0-0-0-0-0-0-0-0-0-11-9-3-15
1026,60,3,RequestNewWinCondition(),Can you give me a new win?,Inform,Assume you demonstrate this win condition,Tianyi,5,5,Ruijie,,0-0-0-0-0-0-0-0-0-0-0-0-6-3-2-7
1026,60,4,RequestNewWinCondition(),Can you give me another new win?,Inform,Assume you demonstrate this win condition,Tianyi,5,5,Ruijie,,0-0-0-11-0-0-1-0-0-2-0-0-4-0-0-0
1026,60,5,"Context Switch, Request(User_ID=1, Rotate)","In this case, can I rotate some pieces and still maintain the win?","Inform([45, 90])","Yes, you can rotate all pieces 45 degrees to the rows and put them in the diagonal, or you can rotate all pieces 90 degrees to the rows and put them in the first column.",Tianyi,5,4,Ruijie,,0-0-0-0-0-0-0-0-0-0-0-0-6-3-2-7
1026,60,6,"Context Switch, Request(User_ID=1, Rotate)","In this win, can I rotate some pieces and still maintain the win?",Inform([90]),"Yes, you can rotate all pieces 90 degrees to the rows and put them in the first column.",Tianyi,5,4,Ruijie,,0-0-0-11-0-0-1-0-0-2-0-0-4-0-0-0
1026,60,7,"Same, Request(User_ID=1, Rotate)",Can I rotate some pieces and still keep winning?,Inform([90]),You can rotate all pieces 90 degrees to the rows and put them in the first column.,Tianyi,4,4,Ruijie,,0-0-0-11-0-0-1-0-0-2-0-0-4-0-0-0
1026,60,8,RequestNewWinCondition(),Can you show me a new winning board?,Inform,Assume you demonstrate this win condition,Tianyi,5,5,Ruijie,,0-0-8-0-0-0-4-0-0-0-14-0-0-0-2-0
1026,60,9,"Context Switch, Confirm(User_ID=1, AddPiece(0,3))","In this winning board, if I put a new piece at the rightmost column of the first row, can it still be a win?",NotSure(),"Sorry, I am not sure about this.",Tianyi,5,4,Ruijie,,0-0-0-8-0-0-13-0-0-16-0-0-6-0-0-0
1026,60,10,"Context Switch, RequestOtherPlayers()","In this board, can someone do something to prevent the win?",Inform([]),"No, there is nothing he/she can do.",Tianyi,5,5,Ruijie,,0-0-0-11-0-0-1-0-0-2-0-0-4-0-0-0
1026,60,11,"Context Switch, Confirm(User_ID=1, AddPiece(1,2))","In this winning board, if I put a new piece at the third column of the second row, can it still be a win?",Affirm(),Yes.,Tianyi,5,5,Ruijie,,0-0-0-0-0-0-0-0-0-0-0-0-11-9-3-15
1026,60,12,RequestNewWinCondition(),Can you show me another new winning board?,Inform,Assume you demonstrate this win condition,Tianyi,5,5,Ruijie,,0-0-0-1-0-0-11-0-0-5-0-0-9-0-0-0
1026,60,13,"Context Switch, Confirm(User_ID=1, RemovePiece(0,3))","In this win, if I remove the piece at the rightmost column, is it still a win?",Negate(),"No, it will no longer be a win if you do that.",Tianyi,5,4,Ruijie,,0-0-0-0-0-0-0-0-0-0-0-0-11-9-3-15
1026,60,14,"Context Switch, Confirm(User_ID=1, Rotate(90))","Back to this board, if I rotate all pieces 90 degrees to the rows and put them in the first column, can it still be a winning board?",Affirm(),Yeah.,Tianyi,4,4,Ruijie,,0-0-0-8-0-0-13-0-0-16-0-0-6-0-0-0
1026,60,15,Finish(),Thank you so much.,Finish,You are welcome.,Tianyi,5,5,Ruijie,,0-0-0-8-0-0-13-0-0-16-0-0-6-0-0-0
