dialog_id,CooperativityRate,Turn Exchange,Formal System Query,NL System Query,Formal User Response,User Response,NL_Student,Correctness Rate,Naturalness Rate,Evaluator,Comments,Board
164,100,0,Start(),"Hi, can you teach me how to play Quarto?",Start,"Sure thing, let's get started.",Jason,5,5,Shaobo,,0-0-0-0-0-0-0-0-0-0-0-0-0-0-0-0
164,100,1,RequestNewWinCondition(),Can you show me one way to win Quarto?,Inform(),Assume you demonstrate this win condition,Jason,5,5,Shaobo,,7-0-0-0-0-13-0-0-0-0-5-0-0-0-0-9
164,100,2,"Same , Confirm(User_ID=1, Color)",Is this a win because of the color of the pieces?,Affirm(),"Yes, all the pieces are the same color.",Jason,5,4,Shaobo,,7-0-0-0-0-13-0-0-0-0-5-0-0-0-0-9
164,100,3,RequestNewWinCondition(),Can you show me a different way to win?,Inform(),Assume you demonstrate this win condition,Jason,5,5,Shaobo,,0-0-0-3-0-0-10-0-0-1-0-0-12-0-0-0
164,100,4,"Same , Confirm(User_ID=1, Shape)","So with this case, is this a win because of the shape of the pieces?",Affirm(),"Yes, they're all triangles.",Jason,5,5,Shaobo,,0-0-0-3-0-0-10-0-0-1-0-0-12-0-0-0
164,100,5,RequestNewWinCondition(),Can you show me a different way to win Quarto?,Inform(),Assume you demonstrate this win condition,Jason,5,5,Shaobo,,0-0-0-10-0-0-1-0-0-13-0-0-9-0-0-0
164,100,6,"Win Context Switch {u'ActionName': u'Confirm_Hollowness', u'FirstPart': None, u'ID': 1, u'SecondPart': None}","Going back to that other win, is this a win because of the hollowness of the pieces?",Negate(),"No, in this case it has nothing to do with the hollowness.",Jason,5,5,Shaobo,,0-0-0-3-0-0-10-0-0-1-0-0-12-0-0-0
164,100,7,"Same, Request(User_ID=1, Translate)",Are there any ways to move these pieces around the board all at once?,Inform([]),"No, it is impossible.",Jason,4,5,Shaobo,imposible (to....); move pieces (to...),0-0-0-3-0-0-10-0-0-1-0-0-12-0-0-0
164,100,8,"Same , Confirm(User_ID=1, Color)",Is this a win because of the color of the pieces?,Negate(),"No, in this case the pieces don't have the same color. That's why it doesn't make it a win.",Jason,5,5,Shaobo,,0-0-0-3-0-0-10-0-0-1-0-0-12-0-0-0
164,100,9,"Context Switch, Request(User_ID=1, Rotate)","Now with that other win you showed me, are there any ways you can rotate the pieces so that it'd still be a win?",Inform([90]),"Yes, you could rotate them to be horizontally along the bottom row.",Jason,3,5,Shaobo,90 means rotate to the first  column,0-0-0-10-0-0-1-0-0-13-0-0-9-0-0-0
164,100,10,RequestNewWinCondition(),Can you show me another way to win Quarto?,Inform(),Assume you demonstrate this win condition,Jason,5,5,Shaobo,,0-0-0-9-0-0-13-0-0-16-0-0-11-0-0-0
164,100,11,Finish(),"Okay, I think that's enough for now. Thank you for all the help!",Finish,"No problem, have a good one.",Jason,5,5,Shaobo,,0-0-0-9-0-0-13-0-0-16-0-0-11-0-0-0
