dialog_id,CooperativityRate,Turn Exchange,Formal System Query,NL System Query,Formal User Response,User Response,NL_Student,Board
351,50,0,Start(),I'd like to learn how to play Quarto. Can you teach me?,Start,"Sure, I'd be happy to.",Jacob,0-0-0-0-0-0-0-0-0-0-0-0-5-6-15-8
351,50,1,RequestNewWinCondition(),Can you show me a winning board state?,Inform,Assume you demonstrate this win condition,Jacob,0-0-0-14-0-0-0-13-0-0-0-9-0-0-0-2
351,50,2,"Same, Confirm(User_ID=1, Color)",Is this a win because of the colors of the pieces?,Negate(),"No, the color does not matter in this case.",Jacob,0-0-0-14-0-0-0-13-0-0-0-9-0-0-0-2
351,50,3,"Same, Request(User_ID=1, Rotate)",In what ways could this pattern of pieces be rotated to yield a new win condition?,Inform([135]),These pieces could lie diagonally from top left to bottom right.,Jacob,0-0-0-14-0-0-0-13-0-0-0-9-0-0-0-2
351,50,4,RequestNewWinCondition(),Can you show me another winning board?,Inform,Assume you demonstrate this win condition,Jacob,0-0-0-0-0-0-0-0-0-0-0-0-15-16-7-5
351,50,5,"Context Switch, Confirm(User_ID=1, Shape)","Going back to this board, is it a win because of the shapes of the pieces?",Negate(),"No, the shape does not matter in this case.",Jacob,0-0-0-14-0-0-0-13-0-0-0-9-0-0-0-2
351,50,6,"Same, Confirm(User_ID=1, Rotate(180))",Would this still be a win if the pieces were aligned horizontally.,NotSure(),I don't really know.,Jacob,0-0-0-14-0-0-0-13-0-0-0-9-0-0-0-2
351,50,7,"Same, Confirm(User_ID=1, Translate([0, 1]))",What about if these pieces lay in the second column? Would that be a win then?,NotSure(),"Sorry, but I don't know that one either.",Jacob,0-0-0-14-0-0-0-13-0-0-0-9-0-0-0-2
351,50,8,"Same, Confirm(User_ID=1, Rotate(135))",What about if they were aligned diagonally from top left to bottom right?,NotSure(),I really couldn't say.,Jacob,0-0-0-14-0-0-0-13-0-0-0-9-0-0-0-2
351,50,9,"Same, Confirm(User_ID=1, Translate([0, 1]))",What about if these pieces were in the second column?,NotSure(),I still don't know if that would work or not.,Jacob,0-0-0-14-0-0-0-13-0-0-0-9-0-0-0-2
351,50,10,"Same, Confirm(User_ID=1, Shape)",Are the shapes of these pieces important to the win?,NotSure(),"I guess I don't know as much about Quarto as I thought, because I don't know that one either.",Jacob,0-0-0-14-0-0-0-13-0-0-0-9-0-0-0-2
351,50,11,Finish(),"Well, thanks anyway. Bye.",Finish,No problem. Sorry I couldn't be of more help.,Jacob,0-0-0-14-0-0-0-13-0-0-0-9-0-0-0-2
