dialog_id,CooperativityRate,Turn Exchange,Formal System Query,NL System Query,Formal User Response,User Response,NL_Student,Correctness Rate,Naturalness Rate,Evaluator,Comments,Board
617,60,0,Start(),Excuse me. Do you know how to play Quarto?,Start,"Yes, and I can show you how.",Yiyan,5,5,Tianyi,,0-0-0-0-0-0-0-0-0-0-0-0-0-0-0-0
617,60,1,RequestNewWinCondition(),"Thank you. Firstly, could you show me a win condition?",Inform,Assume you demonstrate this win condition,Yiyan,5,5,Tianyi,,4-0-0-0-0-16-0-0-0-0-6-0-0-0-0-12
617,60,2,RequestNewWinCondition(),Could you please show me one more win case?,Inform,Assume you demonstrate this win condition,Yiyan,5,5,Tianyi,,0-0-0-0-0-0-0-0-0-0-0-0-15-1-13-9
617,60,3,RequestNewWinCondition(),Is there any other way to win the game?,Inform,Assume you demonstrate this win condition,Yiyan,5,5,Tianyi,,0-0-0-4-0-0-2-0-0-3-0-0-11-0-0-0
617,60,4,"Same, Confirm(User_ID=1, Quantity)","For the last case you showed to me, does the number of the pieces relate to the win?",Affirm(),"Yes, you must have at least four pieces in order to win.",Yiyan,5,5,Tianyi,,0-0-0-4-0-0-2-0-0-3-0-0-11-0-0-0
617,60,5,RequestNewWinCondition(),Can you show me another way to win the game?,Inform,Assume you demonstrate this win condition,Yiyan,5,5,Tianyi,,0-0-0-0-0-0-0-0-0-0-0-0-8-15-13-7
617,60,6,"Same, Confirm(User_ID=1, RemovePiece(0,2))","For the last condition you showed to me, will it still be a win if I remove the piece on the third column?",NotSure(),"I don't know, maybe not?",Yiyan,5,5,Tianyi,,0-0-0-0-0-0-0-0-0-0-0-0-8-15-13-7
617,60,7,"Context Switch, Confirm(User_ID=1, Shape)","Let's consider this case, is it a win because of the shapes of the pieces?",Affirm(),"Yes, you can win by having four pieces with the same shape.",Yiyan,5,5,Tianyi,,0-0-0-4-0-0-2-0-0-3-0-0-11-0-0-0
617,60,8,"Context Switch, Confirm(User_ID=1, RemovePiece(0,0))","Let's switch to this win condition, can I get another win by removing the pieces on the first column?",NotSure(),"I do not know, sorry.",Yiyan,5,5,Tianyi,,0-0-0-0-0-0-0-0-0-0-0-0-8-15-13-7
617,60,9,"Context Switch, Confirm(User_ID=1, Color)","Let's turn to this board, is this a win because there are two different colors?",Negate(),"No, the actual reason is that all the pieces are triangles.",Yiyan,5,5,Tianyi,,0-0-0-4-0-0-2-0-0-3-0-0-11-0-0-0
617,60,10,RequestNewWinCondition(),Could you show me one more win condition?,Inform,Assume you demonstrate this win condition,Yiyan,5,5,Tianyi,,9-0-0-0-0-10-0-0-0-0-6-0-0-0-0-2
617,60,11,"Context Switch, Confirm(User_ID=1, Quantity)","Regarding this win case, does the number of the pieces relate to the win?",Affirm(),"Yes, you need to have at least four pieces in order to win.",Yiyan,5,5,Tianyi,,0-0-0-0-0-0-0-0-0-0-0-0-8-15-13-7
617,60,12,"Same, Request(User_ID=1, Rotate)","For the same board, how can I rotate the pieces to get another win?","Inform([45, 90])",You can rotate the pieces to the diagonal direction or to the first column.,Yiyan,5,5,Tianyi,,0-0-0-0-0-0-0-0-0-0-0-0-8-15-13-7
617,60,13,"Context Switch, Confirm(User_ID=1, Shape)","Let's take a look at this case, is this a win condition because of the shapes of the pieces?",Affirm(),"Yes, as you can see, they all have the same shape.",Yiyan,5,5,Tianyi,,0-0-0-4-0-0-2-0-0-3-0-0-11-0-0-0
617,60,14,"Context Switch, Request(User_ID=1, Translate)","Let's turn to this board, how can I shift the pieces while maintaining the win?","Inform(['row1', 'row2', 'row3'])",You can shift the pieces to any other rows as long as all the pieces stay in the same row.,Yiyan,5,5,Tianyi,,0-0-0-0-0-0-0-0-0-0-0-0-15-1-13-9
617,60,15,Finish(),"Thank you very much, I learned a lot today.",Finish,You are welcome.,Yiyan,5,5,Tianyi,,0-0-0-0-0-0-0-0-0-0-0-0-15-1-13-9
